Position,Const,Created,Modified,Description,Title,URL,Title Type,IMDb Rating,Runtime (mins),Year,Genres,Num Votes,Release Date,Directors,Your Rating,Date Rated,recommendation,newdirector,Country,actor,rated,wins,nominations
377,tt0119643,2016-11-02,2016-11-02,,Meet Joe Black,https://www.imdb.com/title/tt0119643/,movie,7.2,178,1998,"Drama, Fantasy, Romance",194444,1998-11-02,Martin Brest,,,7.86,2017-12-11T00:00:00,USA,"Brad Pitt, Anthony Hopkins, Claire Forlani, Jake Weber",PG-13,3,6
378,tt0918927,2016-11-02,2016-11-02,,Doubt,https://www.imdb.com/title/tt0918927/,movie,7.5,104,2008,"Drama, Mystery",113331,2008-10-30,John Patrick Shanley,,,7.88,1970-01-01T00:00:01,USA,"Meryl Streep, Philip Seymour Hoffman, Amy Adams, Viola Davis",PG-13,26,88
379,tt1645089,2016-11-02,2016-11-02,,Inside Job,https://www.imdb.com/title/tt1645089/,movie,8.3,109,2010,"Documentary, Crime",65130,2010-02-02,Charles Ferguson,,,7.58,1970-01-01T00:00:01,USA,"Matt Damon, Gylfi Zoega, Andri Snær Magnason, Sigridur Benediktsdottir",PG-13,7,26
380,tt0112740,2016-11-02,2016-11-02,,Crimson Tide,https://www.imdb.com/title/tt0112740/,movie,7.3,116,1995,"Action, Drama, Thriller, War",93362,1995-05-12,Tony Scott,,,7.87,2015-12-28T00:00:00,USA,"Denzel Washington, Gene Hackman, Matt Craven, George Dzundza",R,5,6
381,tt1419318,2016-11-02,2016-11-02,,Facing Ali,https://www.imdb.com/title/tt1419318/,movie,8.0,100,2009,"Documentary, Biography, Sport",3124,2009-05-29,Pete McCormack,,,7.78,1970-01-01T00:00:01,"USA, Canada","George Chuvalo, Henry Cooper, George Foreman, Joe Frazier",R,6,0
382,tt0490204,2016-11-02,2016-11-02,,Reign Over Me,https://www.imdb.com/title/tt0490204/,movie,7.5,124,2007,Drama,89795,2007-03-20,Mike Binder,,,7.49,1970-01-01T00:00:01,USA,"Adam Sandler, Don Cheadle, Jada Pinkett Smith, Liv Tyler",R,0,3
383,tt3302820,2016-11-02,2016-11-02,,Cowspiracy: The Sustainability Secret,https://www.imdb.com/title/tt3302820/,movie,8.3,90,2014,Documentary,17500,2014-06-26,"Keegan Kuhn, Kip Andersen",,,7.89,2017-10-04T00:00:00,USA,"Lisa Agabian, Manucher Alemi, Lindsey Allen, Kip Andersen",N/A,0,0
384,tt3080844,2016-11-02,2016-11-02,,Crocodile Gennadiy,https://www.imdb.com/title/tt3080844/,movie,7.5,96,2015,"Documentary, Biography, Drama, News",405,2015-04-16,Steve Hoover,,,7.76,1970-01-01T00:00:01,"Ukraine, USA",Gennadiy Mokhnenko,R,3,0
385,tt1186830,2016-11-02,2016-11-02,,Agora,https://www.imdb.com/title/tt1186830/,movie,7.2,127,2009,"Adventure, Biography, Drama, History, Romance",61340,2009-05-17,Alejandro Amenábar,,,8.41,2019-04-23T00:00:00,Spain,"Rachel Weisz, Max Minghella, Oscar Isaac, Ashraf Barhom",R,11,14
386,tt1416801,2016-11-02,2016-11-02,,Kill the Irishman,https://www.imdb.com/title/tt1416801/,movie,7.1,106,2011,"Biography, Crime, Drama",41377,2011-03-11,Jonathan Hensleigh,,,7.86,1970-01-01T00:00:01,USA,"Ray Stevenson, Vincent D'Onofrio, Val Kilmer, Christopher Walken",R,0,1
387,tt2258858,2016-11-06,2016-11-06,,Wadjda,https://www.imdb.com/title/tt2258858/,movie,7.5,98,2012,"Comedy, Drama",16436,2012-08-31,Haifaa Al-Mansour,,,7.80,1970-01-01T00:00:01,"Saudi Arabia, Netherlands, Germany, Jordan, United Arab Emirates, USA","Reem Abdullah, Waad Mohammed, Abdullrahman Al Gohani, Ahd",PG,22,33
388,tt5895028,2016-11-07,2016-11-07,,13th,https://www.imdb.com/title/tt5895028/,movie,8.2,100,2016,"Documentary, Crime, History",19244,2016-09-30,Ava DuVernay,,,7.64,2017-03-26T00:00:00,USA,"Melina Abdullah, Michelle Alexander, Cory Booker, Dolores Canales",TV-MA,28,43
389,tt2140479,2016-11-09,2016-11-09,,The Accountant,https://www.imdb.com/title/tt2140479/,movie,7.3,128,2016,"Action, Crime, Drama, Thriller",231712,2016-10-10,Gavin O'Connor,,,7.96,1970-01-01T00:00:01,USA,"Ben Affleck, Anna Kendrick, J.K. Simmons, Jon Bernthal",R,3,5
390,tt3263904,2016-11-09,2016-11-09,,Sully,https://www.imdb.com/title/tt3263904/,movie,7.5,96,2016,"Biography, Drama",200938,2016-09-02,Clint Eastwood,,,8.02,2018-12-22T00:00:00,USA,"Tom Hanks, Aaron Eckhart, Valerie Mahaffey, Delphi Harrington",PG-13,12,33
391,tt1996310,2016-12-02,2016-12-02,,Lore,https://www.imdb.com/title/tt1996310/,movie,7.1,109,2012,"Drama, History, Romance, Thriller, War",13338,2012-06-09,Cate Shortland,,,8.53,1970-01-01T00:00:01,"Germany, Australia, UK","Saskia Rosendahl, Nele Trebs, Mike Weidner, Ursina Lardi",NOT RATED,34,35
392,tt1242422,2016-12-03,2016-12-03,,Celda 211,https://www.imdb.com/title/tt1242422/,movie,7.7,113,2009,"Action, Crime, Drama, Thriller",59299,2009-09-04,Daniel Monzón,,,8.30,1970-01-01T00:00:01,"Spain, France","Luis Tosar, Alberto Ammann, Antonio Resines, Manuel Morón",N/A,42,24
393,tt0476735,2016-12-09,2016-12-09,,Babam ve Oglum,https://www.imdb.com/title/tt0476735/,movie,8.4,108,2005,"Drama, Family",65978,2005-11-18,Çagan Irmak,,,7.77,1970-01-01T00:00:01,Turkey,"Çetin Tekindor, Fikret Kuskan, Hümeyra, Ege Tanman",N/A,11,1
394,tt0986264,2016-12-09,2016-12-09,,Taare Zameen Par,https://www.imdb.com/title/tt0986264/,movie,8.4,165,2007,"Drama, Family",140096,2007-12-21,"Aamir Khan, Amole Gupte",,,7.77,1970-01-01T00:00:01,India,"Darsheel Safary, Aamir Khan, Tisca Chopra, Vipin Sharma",PG,14,15
395,tt0242519,2016-12-10,2016-12-10,,Hera Pheri,https://www.imdb.com/title/tt0242519/,movie,8.2,156,2000,"Action, Comedy, Crime, Musical, Thriller",47836,2000-03-31,Priyadarshan,,,7.74,1970-01-01T00:00:01,India,"Akshay Kumar, Paresh Rawal, Sunil Shetty, Tabu",NOT RATED,5,3
396,tt0073707,2016-12-10,2016-12-10,,Sholay,https://www.imdb.com/title/tt0073707/,movie,8.2,198,1975,"Action, Adventure, Comedy, Drama, Musical, Thriller",46160,1975-08-15,Ramesh Sippy,,,7.91,1970-01-01T00:00:01,India,"Sanjeev Kumar, Dharmendra, Amitabh Bachchan, Amjad Khan",NOT RATED,2,0
397,tt0374887,2016-12-10,2016-12-10,,Munna Bhai M.B.B.S.,https://www.imdb.com/title/tt0374887/,movie,8.2,156,2003,"Comedy, Drama, Musical",64074,2003-12-19,Rajkumar Hirani,,,7.83,1970-01-01T00:00:01,India,"Sanjay Dutt, Arshad Warsi, Gracy Singh, Sunil Dutt",NOT RATED,17,29
398,tt4430212,2016-12-10,2016-12-10,,Drishyam,https://www.imdb.com/title/tt4430212/,movie,8.3,163,2015,"Crime, Drama, Mystery, Thriller",54278,2015-07-30,Nishikant Kamat,,,8.01,1970-01-01T00:00:01,India,"Ajay Devgn, Shriya Saran, Tabu, Rajat Kapoor",NOT RATED,2,1
399,tt1639426,2016-12-10,2016-12-10,,Udaan,https://www.imdb.com/title/tt1639426/,movie,8.2,134,2010,Drama,38656,2010-05-19,Vikramaditya Motwane,,,7.60,1970-01-01T00:00:01,India,"Rajat Barmecha, Sanjay Gandhi, Ronit Roy, Manjot Singh",NOT RATED,13,21
400,tt3322420,2016-12-10,2016-12-10,,Queen,https://www.imdb.com/title/tt3322420/,movie,8.2,146,2013,"Comedy, Drama",54821,2013-09-30,Vikas Bahl,,,7.84,1970-01-01T00:00:01,India,"Kangana Ranaut, Rajkummar Rao, Lisa Haydon, Jeffrey Ho",NOT RATED,12,22
401,tt0871510,2016-12-10,2016-12-10,,Chak De! India,https://www.imdb.com/title/tt0871510/,movie,8.2,153,2007,"Drama, Family, Sport",66064,2007-08-10,Shimit Amin,,,7.66,1970-01-01T00:00:01,India,"Shah Rukh Khan, Vidya Malvade, Sagarika Ghatge, Shilpa Shukla",Not Rated,26,18
402,tt1508675,2016-12-10,2016-12-10,,Le Havre,https://www.imdb.com/title/tt1508675/,movie,7.2,93,2011,"Comedy, Drama",18424,2011-05-17,Aki Kaurismäki,,,7.63,1970-01-01T00:00:01,"Finland, France, Germany","André Wilms, Kati Outinen, Jean-Pierre Darroussin, Blondin Miguel",Not Rated,15,32
403,tt0465551,2016-12-10,2016-12-10,,Notes on a Scandal,https://www.imdb.com/title/tt0465551/,movie,7.4,92,2006,"Crime, Drama, Romance, Thriller",70924,2006-12-25,Richard Eyre,,,8.14,1970-01-01T00:00:01,UK,"Judi Dench, Cate Blanchett, Tom Georgeson, Michael Maloney",R,15,68
404,tt4975722,2016-12-10,2016-12-10,,Moonlight,https://www.imdb.com/title/tt4975722/,movie,7.4,111,2016,Drama,225403,2016-09-02,Barry Jenkins,,,8.27,1970-01-01T00:00:01,USA,"Mahershala Ali, Shariff Earp, Duan Sanderson, Alex R. Hibbert",R,220,270
405,tt4034228,2016-12-10,2016-12-10,,Manchester by the Sea,https://www.imdb.com/title/tt4034228/,movie,7.8,137,2016,Drama,212882,2016-01-23,Kenneth Lonergan,,,8.14,1970-01-01T00:00:01,USA,"Casey Affleck, Ben O'Brien, Kyle Chandler, Richard Donelly",R,117,243
406,tt1878870,2016-12-10,2016-12-10,,The Edge of Seventeen,https://www.imdb.com/title/tt1878870/,movie,7.4,104,2016,"Comedy, Drama",86534,2016-09-16,Kelly Fremon Craig,,,7.79,1970-01-01T00:00:01,"USA, China","Hailee Steinfeld, Haley Lu Richardson, Blake Jenner, Kyra Sedgwick",R,6,25
407,tt3783958,2016-12-10,2016-12-10,,La La Land,https://www.imdb.com/title/tt3783958/,movie,8.0,128,2016,"Comedy, Drama, Music, Musical, Romance",431612,2016-08-31,Damien Chazelle,,,8.47,2018-11-26T00:00:00,"USA, Hong Kong","Ryan Gosling, Emma Stone, Amiée Conn, Terry Walters",PG-13,215,254
408,tt4048272,2016-12-10,2016-12-10,,Toni Erdmann,https://www.imdb.com/title/tt4048272/,movie,7.4,162,2016,"Comedy, Drama",37872,2016-05-14,Maren Ade,,,7.84,1970-01-01T00:00:01,"Germany, Austria, Monaco, Romania, France","Sandra Hüller, Peter Simonischek, Michael Wittenborn, Thomas Loibl",R,50,73
409,tt1675192,2016-12-11,2016-12-11,,Take Shelter,https://www.imdb.com/title/tt1675192/,movie,7.4,121,2011,"Drama, Horror, Thriller",82864,2011-01-24,Jeff Nichols,,,7.84,1970-01-01T00:00:01,USA,"Michael Shannon, Jessica Chastain, Tova Stewart, Shea Whigham",R,42,36
410,tt0409459,2016-12-11,2016-12-11,,Watchmen,https://www.imdb.com/title/tt0409459/,movie,7.6,162,2009,"Action, Drama, Mystery, Sci-Fi",452584,2009-02-23,Zack Snyder,,,7.84,2015-03-08T00:00:00,USA,"Malin Akerman, Billy Crudup, Matthew Goode, Jackie Earle Haley",R,11,22
411,tt3169706,2016-12-11,2016-12-11,,Pride,https://www.imdb.com/title/tt3169706/,movie,7.8,119,2014,"Biography, Comedy, Drama, History, Romance",46324,2014-05-23,Matthew Warchus,,,8.05,1970-01-01T00:00:01,"UK, France","Ben Schnetzer, Abram Rooney, Jim McManus, George MacKay",R,9,17
412,tt0449088,2016-12-11,2016-12-11,,Pirates of the Caribbean: At World's End,https://www.imdb.com/title/tt0449088/,movie,7.1,169,2007,"Action, Adventure, Fantasy",554322,2007-05-19,Gore Verbinski,,,7.77,2017-06-03T00:00:00,USA,"Johnny Depp, Geoffrey Rush, Orlando Bloom, Keira Knightley",PG-13,20,44
413,tt0087363,2016-12-23,2016-12-23,,Gremlins,https://www.imdb.com/title/tt0087363/,movie,7.3,106,1984,"Comedy, Fantasy, Horror",176648,1984-06-08,Joe Dante,,,7.72,1970-01-01T00:00:01,USA,"Hoyt Axton, John Louie, Keye Luke, Don Steele",PG,7,6
414,tt2675914,2016-12-23,2016-12-23,,Kraftidioten,https://www.imdb.com/title/tt2675914/,movie,7.2,116,2014,"Action, Crime, Drama, Thriller",20382,2014-02-10,Hans Petter Moland,,,7.87,1970-01-01T00:00:01,"Norway, Denmark, Sweden","Stellan Skarsgård, Bruno Ganz, Pål Sverre Hagen, Jack Sødahl Moland",R,3,10
415,tt4387040,2017-01-05,2017-01-05,,Airlift,https://www.imdb.com/title/tt4387040/,movie,8.1,130,2016,"Drama, History",47991,2016-01-22,Raja Menon,,,7.78,1970-01-01T00:00:01,India,"Akshay Kumar, Nimrat Kaur, Kumud Mishra, Prakash Belawadi",NOT RATED,0,2
416,tt1614989,2017-01-13,2017-01-13,,Hodejegerne,https://www.imdb.com/title/tt1614989/,movie,7.6,96,2011,"Action, Crime, Thriller",90985,2011-08-04,Morten Tyldum,,,7.85,2018-01-02T00:00:00,"Norway, Sweden, Denmark, Germany","Aksel Hennie, Synnøve Macody Lund, Nikolaj Coster-Waldau, Eivind Sander",R,8,11
417,tt0085809,2017-01-31,2017-01-31,,Koyaanisqatsi,https://www.imdb.com/title/tt0085809/,movie,8.3,86,1982,"Documentary, Music",31753,1982-04-27,Godfrey Reggio,,,7.84,1970-01-01T00:00:01,USA,"Lou Dobbs, Ted Koppel",NOT RATED,5,1
418,tt5247022,2017-02-09,2017-02-09,,Paterson,https://www.imdb.com/title/tt5247022/,movie,7.4,118,2016,"Comedy, Drama, Romance",54587,2016-05-16,Jim Jarmusch,,,7.69,1970-01-01T00:00:01,"France, Germany, USA","Adam Driver, Golshifteh Farahani, Nellie, Rizwan Manji",R,9,33
419,tt2359024,2017-02-20,2017-02-20,,Blue Ruin,https://www.imdb.com/title/tt2359024/,movie,7.1,90,2013,"Crime, Drama, Thriller",58472,2013-05-17,Jeremy Saulnier,,,7.87,1970-01-01T00:00:01,"USA, France","Macon Blair, Ydaiber Orozco, Ronald Sarcos, Dani Santiago",R,8,18
420,tt2718492,2017-02-20,2017-02-20,,Ida,https://www.imdb.com/title/tt2718492/,movie,7.4,82,2013,Drama,46529,2013-08-30,Pawel Pawlikowski,,,7.59,1970-01-01T00:00:01,"Poland, Denmark, France, UK","Agata Kulesza, Agata Trzebuchowska, Dawid Ogrodnik, Jerzy Trela",PG-13,66,83
421,tt0040367,2017-02-20,2017-02-20,,A Foreign Affair,https://www.imdb.com/title/tt0040367/,movie,7.4,116,1948,"Comedy, Drama, Romance",6051,1948-06-30,Billy Wilder,,,7.68,2018-07-18T00:00:00,USA,"Jean Arthur, Marlene Dietrich, John Lund, Millard Mitchell",APPROVED,0,1
422,tt5074352,2017-02-20,2017-02-20,,Dangal,https://www.imdb.com/title/tt5074352/,movie,8.5,161,2016,"Action, Biography, Drama, Sport",120408,2016-12-21,Nitesh Tiwari,,,7.76,1970-01-01T00:00:01,India,"Aamir Khan, Fatima Sana Shaikh, Sanya Malhotra, Sakshi Tanwar",NOT RATED,15,0
423,tt2671706,2017-03-06,2017-03-06,,Fences,https://www.imdb.com/title/tt2671706/,movie,7.2,139,2016,Drama,85850,2016-12-06,Denzel Washington,,,7.72,1970-01-01T00:00:01,"USA, Canada","Denzel Washington, Viola Davis, Stephen McKinley Henderson, Jovan Adepo",PG-13,52,106
424,tt1860357,2017-03-06,2017-03-06,,Deepwater Horizon,https://www.imdb.com/title/tt1860357/,movie,7.1,107,2016,"Action, Drama, History, Thriller",132419,2016-09-13,Peter Berg,,,8.01,1970-01-01T00:00:01,"Hong Kong, USA","Mark Wahlberg, Kurt Russell, Douglas M. Griffin, James DuMont",PG-13,3,13
425,tt2178941,2017-03-07,2017-03-07,,Barbara,https://www.imdb.com/title/tt2178941/,movie,7.2,105,2012,Drama,11243,2012-02-11,Christian Petzold,,,7.37,1970-01-01T00:00:01,Germany,"Nina Hoss, Ronald Zehrfeld, Rainer Bock, Christina Hecke",PG-13,10,22
426,tt4972582,2017-03-12,2017-03-12,,Split,https://www.imdb.com/title/tt4972582/,movie,7.3,117,2016,"Horror, Thriller",351838,2016-09-26,M. Night Shyamalan,,,7.44,2015-03-08T00:00:00,"USA, Japan","James McAvoy, Anya Taylor-Joy, Betty Buckley, Haley Lu Richardson",PG-13,8,19
427,tt1048171,2017-03-13,2017-03-13,,Séraphine,https://www.imdb.com/title/tt1048171/,movie,7.4,125,2008,"Biography, Drama",5509,2008-09-07,Martin Provost,,,7.61,1970-01-01T00:00:01,"France, Belgium","Yolande Moreau, Ulrich Tukur, Anne Bennent, Geneviève Mnich",UNRATED,20,7
428,tt0340855,2017-03-20,2017-03-20,,Monster,https://www.imdb.com/title/tt0340855/,movie,7.3,109,2003,"Biography, Crime, Drama, Thriller",124211,2003-11-16,Patty Jenkins,,,7.99,1970-01-01T00:00:01,"Germany, USA","Charlize Theron, Christina Ricci, Bruce Dern, Lee Tergesen",R,29,25
429,tt0056687,2017-03-20,2017-03-20,,What Ever Happened to Baby Jane?,https://www.imdb.com/title/tt0056687/,movie,8.1,134,1962,"Drama, Horror, Thriller",44914,1962-10-31,Robert Aldrich,,,7.63,1970-01-01T00:00:01,USA,"Bette Davis, Joan Crawford, Victor Buono, Wesley Addy",Not Rated,1,11
430,tt0067778,2017-04-04,2017-04-04,,Le souffle au coeur,https://www.imdb.com/title/tt0067778/,movie,7.8,118,1971,"Comedy, Drama",7811,1971-04-28,Louis Malle,,,7.58,2019-03-04T00:00:00,"France, Italy, West Germany","Lea Massari, Benoît Ferreux, Daniel Gélin, Michael Lonsdale",R,2,2
431,tt0082783,2017-04-04,2017-04-04,,My Dinner with Andre,https://www.imdb.com/title/tt0082783/,movie,7.8,110,1981,"Biography, Comedy, Drama",15404,1981-10-08,Louis Malle,,,7.75,2019-03-04T00:00:00,USA,"Andre Gregory, Wallace Shawn, Jean Lenauer, Roy Butler",PG,2,0
432,tt0105750,2017-04-04,2017-04-04,,La vie de bohème,https://www.imdb.com/title/tt0105750/,movie,7.7,103,1992,"Comedy, Drama, Romance",4339,1992-02-18,Aki Kaurismäki,,,7.80,1970-01-01T00:00:01,"Finland, France, Sweden, Germany","Matti Pellonpää, Evelyne Didi, André Wilms, Kari Väänänen",NOT RATED,5,2
433,tt0070510,2017-04-07,2017-04-07,,Paper Moon,https://www.imdb.com/title/tt0070510/,movie,8.1,102,1973,"Comedy, Drama",37905,1973-04-09,Peter Bogdanovich,,,7.80,1970-01-01T00:00:01,USA,"Ryan O'Neal, Tatum O'Neal, Madeline Kahn, John Hillerman",PG,7,10
434,tt0120903,2017-04-13,2017-04-13,,X-Men,https://www.imdb.com/title/tt0120903/,movie,7.4,104,2000,"Action, Adventure, Sci-Fi",532771,2000-07-12,Bryan Singer,,,7.69,2015-09-28T00:00:00,USA,"Hugh Jackman, Patrick Stewart, Ian McKellen, Famke Janssen",PG-13,13,26
435,tt0060107,2017-04-13,2017-04-13,,Andrey Rublev,https://www.imdb.com/title/tt0060107/,movie,8.2,205,1966,"Biography, Drama, History",38537,1966-12-31,Andrei Tarkovsky,,,7.88,1970-01-01T00:00:01,Soviet Union,"Anatoliy Solonitsyn, Ivan Lapikov, Nikolay Grinko, Nikolay Sergeev",NOT RATED,3,0
436,tt0048021,2017-04-14,2017-04-14,,Du rififi chez les hommes,https://www.imdb.com/title/tt0048021/,movie,8.2,118,1955,"Crime, Thriller",22742,1955-04-13,Jules Dassin,,,7.90,1970-01-01T00:00:01,France,"Jean Servais, Carl Möhner, Robert Manuel, Janine Darcey",NOT RATED,6,1
437,tt0049902,2017-04-14,2017-04-14,,Un condamné à mort s'est échappé ou Le vent souffle où il veut,https://www.imdb.com/title/tt0049902/,movie,8.2,101,1956,Drama,15893,1956-11-11,Robert Bresson,,,7.67,1970-01-01T00:00:01,France,"François Leterrier, Charles Le Clainche, Maurice Beerblock, Roland Monod",NOT RATED,3,2
438,tt0040725,2017-05-28,2017-05-28,,The Red Shoes,https://www.imdb.com/title/tt0040725/,movie,8.3,134,1948,"Drama, Music, Romance",24460,1948-07-22,"Michael Powell, Emeric Pressburger",,,7.55,1970-01-01T00:00:01,UK,"Marius Goring, Jean Short, Gordon Littmann, Julia Lang",NOT RATED,3,5
439,tt2404461,2017-06-02,2017-06-02,,Le passé,https://www.imdb.com/title/tt2404461/,movie,7.8,130,2013,"Drama, Mystery",40984,2013-05-17,Asghar Farhadi,,,7.69,2015-02-07T00:00:00,"France, Italy, Belgium, Iran","Bérénice Bejo, Ali Mosaffa, Tahar Rahim, Pauline Burlet",PG-13,12,36
440,tt3606888,2017-06-29,2017-06-29,,A Street Cat Named Bob,https://www.imdb.com/title/tt3606888/,movie,7.4,103,2016,"Biography, Comedy, Drama, Family",23052,2016-11-03,Roger Spottiswoode,,,7.37,1970-01-01T00:00:01,UK,"Luke Treadaway, Bob the Cat, Ruta Gedmintas, Joanne Froggatt",Not Rated,1,0
442,tt0425112,2017-08-08,2017-08-08,,Hot Fuzz,https://www.imdb.com/title/tt0425112/,movie,7.9,121,2007,"Action, Comedy, Mystery",423291,2007-02-14,Edgar Wright,,,7.46,1970-01-01T00:00:01,"UK, France","Simon Pegg, Martin Freeman, Bill Nighy, Robert Popper",R,2,9
443,tt5013056,2017-08-09,2017-08-09,,Dunkirk,https://www.imdb.com/title/tt5013056/,movie,7.9,106,2017,"Action, Drama, History, Thriller, War",461127,2017-07-13,Christopher Nolan,,,8.22,2016-12-06T00:00:00,"UK, Netherlands, France, USA","Fionn Whitehead, Damien Bonnard, Aneurin Barnard, Lee Armstrong",PG-13,51,197
444,tt0490215,2017-08-28,2017-08-28,,Silence,https://www.imdb.com/title/tt0490215/,movie,7.2,161,2016,"Adventure, Drama, History",84520,2016-11-29,Martin Scorsese,,,8.26,2017-05-04T00:00:00,"Mexico, Taiwan, UK, USA, Japan, Italy","Andrew Garfield, Adam Driver, Liam Neeson, Tadanobu Asano",R,6,51
445,tt0119177,2017-09-08,2017-09-08,,Gattaca,https://www.imdb.com/title/tt0119177/,movie,7.8,106,1997,"Drama, Sci-Fi, Thriller",259337,1997-09-07,Andrew Niccol,,,7.83,1970-01-01T00:00:01,USA,"Ethan Hawke, Uma Thurman, Gore Vidal, Xander Berkeley",PG-13,6,14
446,tt4016934,2017-09-30,2017-09-30,,Ah-ga-ssi,https://www.imdb.com/title/tt4016934/,movie,8.1,145,2016,"Drama, Romance, Thriller",77467,2016-05-14,Chan-wook Park,,,8.10,1970-01-01T00:00:01,South Korea,"Min-hee Kim, Tae-ri Kim, Jung-woo Ha, Jin-Woong Cho",Not Rated,59,88
447,tt3062880,2017-11-13,2017-11-13,,Gett,https://www.imdb.com/title/tt3062880/,movie,7.7,115,2014,Drama,5502,2014-05-16,"Ronit Elkabetz, Shlomi Elkabetz",,,7.57,1970-01-01T00:00:01,"Israel, France, Germany","Ronit Elkabetz, Simon Abkarian, Gabi Amrani, Dalia Beger",NOT RATED,15,16
448,tt0016641,2017-11-25,2017-11-25,,Ben-Hur: A Tale of the Christ,https://www.imdb.com/title/tt0016641/,movie,8.0,143,1925,"Adventure, Drama, Romance",6805,1925-12-25,"Charles Brabin, Christy Cabanne, Rex Ingram, Fred Niblo, J.J. Cohn",,,8.02,1970-01-01T00:00:01,USA,"Ramon Novarro, Francis X. Bushman, May McAvoy, Betty Bronson",NOT RATED,1,0
449,tt0049470,2017-12-07,2017-12-07,,The Man Who Knew Too Much,https://www.imdb.com/title/tt0049470/,movie,7.5,120,1956,"Drama, Thriller",51465,1956-04-29,Alfred Hitchcock,,,8.14,2018-10-29T00:00:00,USA,"James Stewart, Doris Day, Brenda de Banzie, Bernard Miles",PG,1,4
450,tt4420704,2017-12-10,2017-12-10,,Kedi,https://www.imdb.com/title/tt4420704/,movie,7.7,79,2016,Documentary,10808,2016-02-21,Ceyda Torun,,,7.74,1970-01-01T00:00:01,"Turkey, USA","Yaman Barlas, Sari, Arzu Göl, Kemal Suncu",Not Rated,4,19
451,tt0059229,2017-12-19,2017-12-19,,Giulietta degli spiriti,https://www.imdb.com/title/tt0059229/,movie,7.6,137,1965,"Comedy, Drama, Fantasy",10225,1965-10-16,Federico Fellini,,,7.70,1970-01-01T00:00:01,"Italy, France","Giulietta Masina, Sandra Milo, Mario Pisu, Valentina Cortese",NOT RATED,11,2
452,tt0051036,2018-01-11,2018-01-11,,Sweet Smell of Success,https://www.imdb.com/title/tt0051036/,movie,8.1,96,1957,"Drama, Film-Noir",24293,1957-06-27,Alexander Mackendrick,,,7.38,1970-01-01T00:00:01,USA,"Burt Lancaster, Tony Curtis, Susan Harrison, Martin Milner",Not Rated,3,2
453,tt0062229,2018-01-11,2018-01-11,,Le samouraï,https://www.imdb.com/title/tt0062229/,movie,8.1,105,1967,"Crime, Drama, Mystery, Thriller",38958,1967-10-25,Jean-Pierre Melville,,,7.71,1970-01-01T00:00:01,"France, Italy","Alain Delon, François Périer, Nathalie Delon, Cathy Rosier",GP,0,0
454,tt0063522,2018-01-11,2018-01-11,,Rosemary's Baby,https://www.imdb.com/title/tt0063522/,movie,8.0,137,1968,"Drama, Horror",168931,1968-06-12,Roman Polanski,,,7.18,2018-04-23T00:00:00,USA,"Mia Farrow, John Cassavetes, Ruth Gordon, Sidney Blackmer",APPROVED,9,12
455,tt0046478,2018-01-11,2018-01-11,,Ugetsu monogatari,https://www.imdb.com/title/tt0046478/,movie,8.2,96,1953,"Drama, Fantasy, War",17820,1953-03-26,Kenji Mizoguchi,,,7.82,1970-01-01T00:00:01,Japan,"Machiko Kyô, Mitsuko Mito, Kinuyo Tanaka, Masayuki Mori",NOT RATED,4,1
456,tt0056058,2018-01-11,2018-01-11,,Seppuku,https://www.imdb.com/title/tt0056058/,movie,8.7,133,1962,"Action, Drama, History",24217,1962-09-16,Masaki Kobayashi,,,7.88,1970-01-01T00:00:01,Japan,"Tatsuya Nakadai, Akira Ishihama, Shima Iwashita, Tetsurô Tanba",NOT RATED,8,2
457,tt0091064,2018-01-25,2018-01-25,,The Fly,https://www.imdb.com/title/tt0091064/,movie,7.5,96,1986,"Drama, Horror, Sci-Fi",144012,1986-08-15,David Cronenberg,,,7.58,1970-01-01T00:00:01,"USA, UK, Canada","Jeff Goldblum, Geena Davis, John Getz, Joy Boushel",R,5,11
458,tt7174366,2018-02-03,2018-02-03,,The Heretic,https://www.imdb.com/title/tt7174366/,movie,8.0,71,2018,Documentary,57,2018-03-01,Andrew Morgan,,,7.89,1970-01-01T00:00:01,USA,N/A,N/A,0,0
459,tt3268850,2018-02-08,2018-02-08,,Unrest,https://www.imdb.com/title/tt3268850/,movie,7.8,98,2017,"Documentary, Drama, History, Romance",2135,2017-01-20,Jennifer Brea,,,8.09,1970-01-01T00:00:01,"UK, USA","Jennifer Brea, Omar Wasow, Jessica l e Taylor, Samuel Bearman",N/A,7,7
460,tt1856101,2018-02-12,2018-02-12,,Blade Runner 2049,https://www.imdb.com/title/tt1856101/,movie,8.0,164,2017,"Drama, Mystery, Sci-Fi, Thriller",372353,2017-10-03,Denis Villeneuve,,,8.28,2017-05-23T00:00:00,"USA, UK, Hungary, Canada","Ryan Gosling, Dave Bautista, Robin Wright, Mark Arnold",R,81,131
461,tt0338751,2018-02-12,2018-02-12,,The Aviator,https://www.imdb.com/title/tt0338751/,movie,7.5,170,2004,"Biography, Drama",306524,2004-12-14,Martin Scorsese,,,8.12,2017-05-04T00:00:00,"Germany, USA","Leonardo DiCaprio, Cate Blanchett, Kate Beckinsale, John C. Reilly",PG-13,81,130
462,tt0375063,2018-02-12,2018-02-12,,Sideways,https://www.imdb.com/title/tt0375063/,movie,7.5,127,2004,"Comedy, Drama, Romance",169263,2004-09-13,Alexander Payne,,,8.08,2015-02-14T00:00:00,"USA, Hungary","Paul Giamatti, Thomas Haden Church, Virginia Madsen, Sandra Oh",R,122,87
463,tt0350258,2018-02-12,2018-02-12,,Ray,https://www.imdb.com/title/tt0350258/,movie,7.7,152,2004,"Biography, Drama, Music",127194,2004-09-12,Taylor Hackford,,,7.83,1970-01-01T00:00:01,USA,"Jamie Foxx, Kerry Washington, Regina King, Clifton Powell",PG-13,52,54
464,tt0388789,2018-02-12,2018-02-12,,Born Into Brothels: Calcutta's Red Light Kids,https://www.imdb.com/title/tt0388789/,movie,7.3,85,2004,Documentary,14843,2004-01-17,"Ross Kauffman, Zana Briski",,,7.75,1970-01-01T00:00:01,USA,"Kochi, Avijit Halder, Shanti Das, Manik",R,20,5
465,tt0379725,2018-02-12,2018-02-12,,Capote,https://www.imdb.com/title/tt0379725/,movie,7.4,114,2005,"Biography, Crime, Drama, History",116670,2005-09-02,Bennett Miller,,,8.35,1970-01-01T00:00:01,"USA, Canada","Allie Mickelson, Kelci Stephenson, Philip Seymour Hoffman, Craig Archibald",R,58,86
466,tt0365737,2018-02-12,2018-02-12,,Syriana,https://www.imdb.com/title/tt0365737/,movie,6.9,128,2005,"Drama, Thriller",120146,2005-11-23,Stephen Gaghan,,,7.74,1970-01-01T00:00:01,"USA, United Arab Emirates","Kayvan Novak, George Clooney, Amr Waked, Christopher Plummer",R,13,28
467,tt0387131,2018-02-12,2018-02-12,,The Constant Gardener,https://www.imdb.com/title/tt0387131/,movie,7.4,129,2005,"Drama, Mystery, Romance, Thriller",125108,2005-07-31,Fernando Meirelles,,,8.24,1970-01-01T00:00:01,"UK, Germany, USA, China","Ralph Fiennes, Rachel Weisz, Hubert Koundé, Danny Huston",R,35,68
468,tt0455590,2018-02-12,2018-02-12,,The Last King of Scotland,https://www.imdb.com/title/tt0455590/,movie,7.7,123,2006,"Biography, Drama, History, Thriller",164981,2006-09-01,Kevin Macdonald,,,8.11,1970-01-01T00:00:01,"UK, Germany","Forest Whitaker, James McAvoy, Kerry Washington, Gillian Anderson",R,47,31
469,tt0436697,2018-02-12,2018-02-12,,The Queen,https://www.imdb.com/title/tt0436697/,movie,7.3,103,2006,"Biography, Drama, History",97549,2006-09-02,Stephen Frears,,,7.86,1970-01-01T00:00:01,"UK, USA, France, Italy","Helen Mirren, James Cromwell, Alex Jennings, Roger Allam",PG-13,94,95
470,tt0450188,2018-02-12,2018-02-12,,La môme,https://www.imdb.com/title/tt0450188/,movie,7.6,140,2007,"Biography, Drama, Music, Romance",77129,2007-02-08,Olivier Dahan,,,7.93,1970-01-01T00:00:01,"France, UK, Czech Republic","Marion Cotillard, Sylvie Testud, Pascal Greggory, Emmanuelle Seigner",PG-13,45,61
