Position,Const,Created,Modified,Description,Title,URL,Title Type,IMDb Rating,Runtime (mins),Year,Genres,Num Votes,Release Date,Directors,Your Rating,Date Rated,recommendation,newdirector,Country,actor,rated,wins,nominations
1030,tt1562872,2018-10-19,2018-10-19,,Zindagi Na Milegi Dobara,https://www.imdb.com/title/tt1562872/,movie,8.1,155,2011,"Comedy, Drama",58477,2011-07-15,Zoya Akhtar,,,7.82,1970-01-01T00:00:01,India,"Hrithik Roshan, Farhan Akhtar, Abhay Deol, Katrina Kaif",NOT RATED,19,16
1031,tt0270053,2018-10-19,2018-10-19,,Vizontele,https://www.imdb.com/title/tt0270053/,movie,8.0,110,2001,"Comedy, Drama",28451,2001-02-02,"Ömer Faruk Sorak, Yilmaz Erdogan",,,7.74,2018-03-31T00:00:00,Turkey,"Yilmaz Erdogan, Demet Akbag, Altan Erkekli, Cem Yilmaz",N/A,5,0
1032,tt0456144,2018-10-19,2018-10-19,,Lage Raho Munna Bhai,https://www.imdb.com/title/tt0456144/,movie,8.1,144,2006,"Comedy, Drama, Fantasy, Romance",38152,2006-09-01,Rajkumar Hirani,,,7.85,1970-01-01T00:00:01,India,"Sanjay Dutt, Arshad Warsi, Vidya Balan, Jimmy Sheirgill",PG-13,14,13
1033,tt3606756,2018-10-19,2018-10-19,,Incredibles 2,https://www.imdb.com/title/tt3606756/,movie,7.7,118,2018,"Animation, Action, Adventure, Comedy, Family, Sci-Fi",198253,2018-06-05,Brad Bird,,,7.76,1970-01-01T00:00:01,USA,"Craig T. Nelson, Holly Hunter, Sarah Vowell, Huck Milner",PG,0,0
1034,tt5104604,2018-10-19,2018-10-19,,Isle of Dogs,https://www.imdb.com/title/tt5104604/,movie,7.9,101,2018,"Animation, Adventure, Comedy, Drama, Fantasy, Sci-Fi",105661,2018-02-15,Wes Anderson,,,7.91,1970-01-01T00:00:01,"Germany, USA","Bryan Cranston, Koyu Rankin, Edward Norton, Bob Balaban",PG-13,2,0
1035,tt2948356,2018-10-19,2018-10-19,,Zootopia,https://www.imdb.com/title/tt2948356/,movie,8.0,108,2016,"Animation, Adventure, Comedy, Crime, Family, Mystery",379997,2016-02-11,"Rich Moore, Jared Bush, Byron Howard",,,8.17,1970-01-01T00:00:01,USA,"Ginnifer Goodwin, Jason Bateman, Idris Elba, Jenny Slate",PG,45,65
1036,tt3544112,2018-10-19,2018-10-19,,Sing Street,https://www.imdb.com/title/tt3544112/,movie,8.0,106,2016,"Comedy, Drama, Music, Romance",74147,2016-01-24,John Carney,,,7.78,1970-01-01T00:00:01,"Ireland, UK, USA","Ferdia Walsh-Peelo, Kelly Thornton, Maria Doyle Kennedy, Jack Reynor",PG-13,13,37
1037,tt3863552,2018-10-19,2018-10-19,,Bajrangi Bhaijaan,https://www.imdb.com/title/tt3863552/,movie,8.0,163,2015,"Action, Comedy, Drama",63111,2015-07-15,Kabir Khan,,,7.53,1970-01-01T00:00:01,India,"Salman Khan, Harshaali Malhotra, Nawazuddin Siddiqui, Kareena Kapoor",Not Rated,14,3
1038,tt0401085,2018-10-19,2018-10-19,,C.R.A.Z.Y.,https://www.imdb.com/title/tt0401085/,movie,8.0,127,2005,"Comedy, Drama",30139,2005-05-27,Jean-Marc Vallée,,,7.80,2017-05-26T00:00:00,Canada,"Michel Côté, Marc-André Grondin, Danielle Proulx, Émile Vallée",NOT RATED,38,7
1039,tt0384116,2018-10-19,2018-10-19,,G.O.R.A.,https://www.imdb.com/title/tt0384116/,movie,8.0,127,2004,"Adventure, Comedy, Sci-Fi",49463,2004-11-12,Ömer Faruk Sorak,,,7.77,1970-01-01T00:00:01,Turkey,"Cem Yilmaz, Rasim Öztekin, Özkan Ugur, Idil Firat",N/A,0,0
1040,tt5463162,2018-10-19,2018-10-19,,Deadpool 2,https://www.imdb.com/title/tt5463162/,movie,7.8,119,2018,"Action, Adventure, Comedy, Sci-Fi",381101,2018-05-01,David Leitch,,,7.67,1970-01-01T00:00:01,USA,"Ryan Reynolds, Josh Brolin, Morena Baccarin, Julian Dennison",R,0,0
1041,tt3501632,2018-10-19,2018-10-19,,Thor: Ragnarok,https://www.imdb.com/title/tt3501632/,movie,7.9,130,2017,"Action, Adventure, Comedy, Fantasy, Sci-Fi",468654,2017-10-10,Taika Waititi,,,7.77,1970-01-01T00:00:01,"USA, Australia","Chris Hemsworth, Tom Hiddleston, Cate Blanchett, Idris Elba",PG-13,5,30
1042,tt4468740,2018-10-19,2018-10-19,,Paddington 2,https://www.imdb.com/title/tt4468740/,movie,7.9,103,2017,"Adventure, Comedy, Family, Fantasy",45602,2017-11-05,Paul King,,,7.77,1970-01-01T00:00:01,"UK, France, USA","Michael Gambon, Imelda Staunton, Ben Whishaw, Madeleine Harris",PG,3,7
1043,tt0460791,2018-10-19,2018-10-19,,The Fall,https://www.imdb.com/title/tt0460791/,movie,7.9,117,2006,"Adventure, Comedy, Drama, Fantasy",101429,2006-09-09,Tarsem Singh,,,7.99,1970-01-01T00:00:01,"USA, South Africa, India","Catinca Untaru, Justine Waddell, Lee Pace, Kim Uylenbroek",R,4,11
1044,tt1093370,2018-10-19,2018-10-19,,Jab We Met,https://www.imdb.com/title/tt1093370/,movie,7.9,138,2007,"Comedy, Drama, Romance",41976,2007-10-26,Imtiaz Ali,,,7.86,1970-01-01T00:00:01,India,"Shahid Kapoor, Kareena Kapoor, Tarun Arora, Dara Singh",NOT RATED,7,14
1045,tt2181931,2018-10-19,2018-10-19,,English Vinglish,https://www.imdb.com/title/tt2181931/,movie,7.9,134,2012,"Comedy, Drama, Family",30143,2012-09-14,Gauri Shinde,,,7.76,1970-01-01T00:00:01,India,"Sridevi, Adil Hussain, Mehdi Nebbou, Priya Anand",NOT RATED,8,15
1046,tt7349662,2018-10-19,2018-10-19,,BlacKkKlansman,https://www.imdb.com/title/tt7349662/,movie,7.5,135,2018,"Biography, Crime, Drama",140570,2018-05-14,Spike Lee,,,7.89,1970-01-01T00:00:01,USA,"Alec Baldwin, John David Washington, Isiah Whitlock Jr., Robert John Burke",R,0,0
1047,tt0089218,2018-10-19,2018-10-19,,The Goonies,https://www.imdb.com/title/tt0089218/,movie,7.8,114,1985,"Adventure, Comedy, Family",216060,1985-06-07,Richard Donner,,,7.75,1970-01-01T00:00:01,USA,"Sean Astin, Josh Brolin, Jeff Cohen, Corey Feldman",PG,3,6
1048,tt2194499,2018-10-19,2018-10-19,,About Time,https://www.imdb.com/title/tt2194499/,movie,7.8,123,2013,"Comedy, Drama, Fantasy, Romance, Sci-Fi",259998,2013-06-27,Richard Curtis,,,7.78,1970-01-01T00:00:01,UK,"Domhnall Gleeson, Rachel McAdams, Bill Nighy, Lydia Wilson",R,3,10
1049,tt0108037,2018-10-19,2018-10-19,,The Sandlot,https://www.imdb.com/title/tt0108037/,movie,7.8,101,1993,"Comedy, Drama, Family, Sport",70871,1993-04-07,David Mickey Evans,,,7.64,1970-01-01T00:00:01,USA,"Art LaFleur, Tom Guiry, Mike Vitar, Patrick Renna",PG,1,0
1050,tt0096874,2018-10-19,2018-10-19,,Back to the Future Part II,https://www.imdb.com/title/tt0096874/,movie,7.8,108,1989,"Adventure, Comedy, Sci-Fi",423841,1989-11-20,Robert Zemeckis,,,7.75,2015-10-12T00:00:00,USA,"Michael J. Fox, Christopher Lloyd, Lea Thompson, Thomas F. Wilson",PG,9,8
1051,tt2582496,2018-10-19,2018-10-19,,Me and Earl and the Dying Girl,https://www.imdb.com/title/tt2582496/,movie,7.8,105,2015,"Comedy, Drama, Romance",112007,2015-01-25,Alfonso Gomez-Rejon,,,7.85,1970-01-01T00:00:01,USA,"Thomas Mann, RJ Cyler, Olivia Cooke, Nick Offerman",PG-13,17,29
1052,tt4901306,2018-10-19,2018-10-19,,Perfetti sconosciuti,https://www.imdb.com/title/tt4901306/,movie,7.8,97,2016,"Comedy, Drama",44971,2016-02-02,Paolo Genovese,,,7.92,1970-01-01T00:00:01,Italy,"Giuseppe Battiston, Anna Foglietta, Marco Giallini, Edoardo Leo",N/A,13,13
1053,tt0102536,2018-10-19,2018-10-19,,Night on Earth,https://www.imdb.com/title/tt0102536/,movie,7.8,129,1991,"Comedy, Drama",49715,1991-10-04,Jim Jarmusch,,,7.52,1970-01-01T00:00:01,"France, UK, Germany, USA, Japan","Gena Rowlands, Winona Ryder, Lisanne Falk, Alan Randolph Scott",R,1,1
1054,tt0248845,2018-10-19,2018-10-19,,Hedwig and the Angry Inch,https://www.imdb.com/title/tt0248845/,movie,7.8,95,2001,"Comedy, Drama, Music, Musical",29410,2001-01-19,John Cameron Mitchell,,,7.84,1970-01-01T00:00:01,USA,"John Cameron Mitchell, Miriam Shor, Stephen Trask, Theodore Liscinski",R,28,32
1055,tt2317337,2018-10-19,2018-10-19,,Vicky Donor,https://www.imdb.com/title/tt2317337/,movie,7.8,126,2012,"Comedy, Romance",35198,2012-04-19,Shoojit Sircar,,,7.80,1970-01-01T00:00:01,India,"Ayushmann Khurrana, Yami Gautam, Annu Kapoor, Dolly Ahluwalia",NOT RATED,22,13
1056,tt3896198,2018-10-19,2018-10-19,,Guardians of the Galaxy Vol. 2,https://www.imdb.com/title/tt3896198/,movie,7.7,136,2017,"Action, Adventure, Comedy, Sci-Fi",472909,2017-04-10,James Gunn,,,7.69,1970-01-01T00:00:01,USA,"Chris Pratt, Zoe Saldana, Dave Bautista, Vin Diesel",PG-13,12,42
1057,tt5164432,2018-10-19,2018-10-19,,"Love, Simon",https://www.imdb.com/title/tt5164432/,movie,7.6,110,2018,"Comedy, Drama, Romance",79928,2018-02-27,Greg Berlanti,,,7.78,1970-01-01T00:00:01,USA,"Nick Robinson, Jennifer Garner, Josh Duhamel, Katherine Langford",PG-13,0,0
1058,tt1323594,2018-10-19,2018-10-19,,Despicable Me,https://www.imdb.com/title/tt1323594/,movie,7.7,95,2010,"Animation, Comedy, Family, Fantasy",462267,2010-06-20,"Chris Renaud, Pierre Coffin",,,7.63,1970-01-01T00:00:01,"USA, France","Steve Carell, Jason Segel, Russell Brand, Julie Andrews",PG,3,40
1059,tt0120669,2018-10-19,2018-10-19,,Fear and Loathing in Las Vegas,https://www.imdb.com/title/tt0120669/,movie,7.7,118,1998,"Adventure, Comedy, Drama",241533,1998-05-15,Terry Gilliam,,,7.77,2015-11-04T00:00:00,USA,"Johnny Depp, Benicio Del Toro, Tobey Maguire, Michael Lee Gogin",R,1,3
1060,tt0065938,2018-10-19,2018-10-19,,Kelly's Heroes,https://www.imdb.com/title/tt0065938/,movie,7.7,144,1970,"Adventure, Comedy, War",41251,1970-06-23,Brian G. Hutton,,,7.73,2019-02-18T00:00:00,USA,"Clint Eastwood, Telly Savalas, Don Rickles, Carroll O'Connor",GP,0,1
1061,tt4080728,2018-10-19,2018-10-19,,En man som heter Ove,https://www.imdb.com/title/tt4080728/,movie,7.7,116,2015,"Comedy, Drama, Romance",38761,2015-12-13,Hannes Holm,,,7.74,1970-01-01T00:00:01,Sweden,"Rolf Lassgård, Bahar Pars, Filip Berg, Ida Engvoll",PG-13,14,21
1062,tt0063374,2018-10-19,2018-10-19,,The Odd Couple,https://www.imdb.com/title/tt0063374/,movie,7.7,105,1968,Comedy,29101,1968-05-02,Gene Saks,,,7.85,1970-01-01T00:00:01,USA,"Jack Lemmon, Walter Matthau, John Fiedler, Herb Edelman",G,3,7
1063,tt0364517,2018-10-19,2018-10-19,,Jeux d'enfants,https://www.imdb.com/title/tt0364517/,movie,7.7,93,2003,"Comedy, Drama, Romance",63406,2003-08-29,Yann Samuell,,,7.93,1970-01-01T00:00:01,"France, Belgium","Guillaume Canet, Marion Cotillard, Thibault Verhaeghe, Joséphine Lebas-Joly",R,5,2
1064,tt0165832,2018-10-19,2018-10-19,,Interstate 60: Episodes of the Road,https://www.imdb.com/title/tt0165832/,movie,7.7,116,2002,"Adventure, Comedy, Drama, Fantasy",27440,2002-04-13,Bob Gale,,,7.97,1970-01-01T00:00:01,"Canada, USA","Matthew Edison, Paul Brogren, Wayne Robson, Gary Oldman",R,2,5
1065,tt0104940,2018-10-19,2018-10-19,,The Muppet Christmas Carol,https://www.imdb.com/title/tt0104940/,movie,7.7,85,1992,"Comedy, Drama, Family, Fantasy, Musical",42684,1992-12-06,Brian Henson,,,7.47,1970-01-01T00:00:01,"USA, UK","Michael Caine, Dave Goelz, Steve Whitmire, Jerry Nelson",G,1,1
1066,tt0119038,2018-10-19,2018-10-19,,Le dîner de cons,https://www.imdb.com/title/tt0119038/,movie,7.7,80,1998,Comedy,34337,1998-04-15,Francis Veber,,,8.13,1970-01-01T00:00:01,France,"Thierry Lhermitte, Jacques Villeret, Francis Huster, Daniel Prévost",PG-13,5,4
1067,tt0172684,2018-10-19,2018-10-19,,Kuch Kuch Hota Hai,https://www.imdb.com/title/tt0172684/,movie,7.7,177,1998,"Comedy, Drama, Musical, Romance",43042,1998-10-16,Karan Johar,,,7.63,1970-01-01T00:00:01,India,"Shah Rukh Khan, Kajol, Rani Mukerji, Sana Saeed",Not Rated,12,0
1068,tt0338135,2018-10-19,2018-10-19,,Les invasions barbares,https://www.imdb.com/title/tt0338135/,movie,7.7,99,2003,"Comedy, Crime, Drama, Mystery, Romance",26922,2003-05-21,Denys Arcand,,,8.33,1970-01-01T00:00:01,"Canada, France","Rémy Girard, Stéphane Rousseau, Marie-Josée Croze, Marina Hands",R,48,33
1069,tt3521164,2018-10-19,2018-10-19,,Moana,https://www.imdb.com/title/tt3521164/,movie,7.6,107,2016,"Animation, Adventure, Comedy, Family, Fantasy, Musical",221814,2016-11-14,"Don Hall, Ron Clements, John Musker, Chris Williams",,,8.07,1970-01-01T00:00:01,USA,"Auli'i Cravalho, Dwayne Johnson, Rachel House, Temuera Morrison",PG,18,83
1070,tt0314331,2018-10-19,2018-10-19,,Love Actually,https://www.imdb.com/title/tt0314331/,movie,7.6,135,2003,"Comedy, Drama, Romance",384978,2003-09-07,Richard Curtis,,,7.61,1970-01-01T00:00:01,"UK, USA, France","Bill Nighy, Gregor Fisher, Rory MacGregor, Colin Firth",R,10,27
1071,tt1250777,2018-10-19,2018-10-19,,Kick-Ass,https://www.imdb.com/title/tt1250777/,movie,7.6,117,2010,"Action, Comedy",495382,2010-03-12,Matthew Vaughn,,,7.67,1970-01-01T00:00:01,"UK, USA","Aaron Taylor-Johnson, Garrett M. Brown, Evan Peters, Deborah Twiss",R,19,61
1072,tt0057193,2018-10-19,2018-10-19,,It's a Mad Mad Mad Mad World,https://www.imdb.com/title/tt0057193/,movie,7.6,205,1963,"Action, Adventure, Comedy, Crime",34524,1963-11-07,Stanley Kramer,,,7.58,1970-01-01T00:00:01,USA,"Spencer Tracy, Milton Berle, Sid Caesar, Buddy Hackett",G,2,10
1073,tt5462602,2018-10-19,2018-10-19,,The Big Sick,https://www.imdb.com/title/tt5462602/,movie,7.6,120,2017,"Comedy, Drama, Romance",103133,2017-01-20,Michael Showalter,,,8.02,1970-01-01T00:00:01,USA,"Kumail Nanjiani, Zoe Kazan, Holly Hunter, Ray Romano",R,16,84
1074,tt0097958,2018-10-19,2018-10-19,,National Lampoon's Christmas Vacation,https://www.imdb.com/title/tt0097958/,movie,7.6,97,1989,Comedy,133634,1989-11-30,Jeremiah S. Chechik,,,7.95,1970-01-01T00:00:01,USA,"Chevy Chase, Beverly D'Angelo, Juliette Lewis, Johnny Galecki",PG-13,0,0
1075,tt0070608,2018-10-19,2018-10-19,,Robin Hood,https://www.imdb.com/title/tt0070608/,movie,7.6,83,1973,"Animation, Adventure, Comedy, Family, Romance",103124,1973-11-08,Wolfgang Reitherman,,,7.66,1970-01-01T00:00:01,USA,"Roger Miller, Peter Ustinov, Terry-Thomas, Brian Bedford",G,1,1
1076,tt0420223,2018-10-19,2018-10-19,,Stranger Than Fiction,https://www.imdb.com/title/tt0420223/,movie,7.6,113,2006,"Comedy, Drama, Fantasy, Romance",206286,2006-09-09,Marc Forster,,,7.88,2015-03-08T00:00:00,USA,"Will Ferrell, William Dick, Guy Massey, Martha Espinoza",PG-13,3,14
1077,tt0079261,2018-10-19,2018-10-19,,Hair,https://www.imdb.com/title/tt0079261/,movie,7.6,121,1979,"Comedy, Drama, Musical, Romance, War",32094,1979-03-14,Milos Forman,,,7.90,2017-09-30T00:00:00,"West Germany, USA","John Savage, Treat Williams, Beverly D'Angelo, Annie Golden",PG,2,2
1078,tt0327137,2018-10-19,2018-10-19,,Secondhand Lions,https://www.imdb.com/title/tt0327137/,movie,7.6,111,2003,"Comedy, Drama, Family",48365,2003-09-05,Tim McCanlies,,,7.77,1970-01-01T00:00:01,USA,"Michael Caine, Robert Duvall, Haley Joel Osment, Kyra Sedgwick",PG,1,6
1079,tt0103939,2018-10-19,2018-10-19,,Chaplin,https://www.imdb.com/title/tt0103939/,movie,7.6,143,1992,"Biography, Comedy, Drama",49446,1992-12-16,Richard Attenborough,,,7.37,2017-04-13T00:00:00,"UK, France, Italy, Japan, USA","Robert Downey Jr., Geraldine Chaplin, Paul Rhys, John Thaw",PG-13,3,16
1080,tt0101605,2018-10-19,2018-10-19,,The Commitments,https://www.imdb.com/title/tt0101605/,movie,7.6,118,1991,"Comedy, Drama, Music",29807,1991-08-07,Alan Parker,,,7.63,1970-01-01T00:00:01,"Ireland, UK, USA","Robert Arkins, Michael Aherne, Angeline Ball, Maria Doyle Kennedy",R,11,10
1081,tt0047673,2018-10-19,2018-10-19,,White Christmas,https://www.imdb.com/title/tt0047673/,movie,7.6,120,1954,"Comedy, Musical, Romance",28380,1954-10-14,Michael Curtiz,,,7.56,2014-05-05T00:00:00,USA,"Bing Crosby, Danny Kaye, Rosemary Clooney, Vera-Ellen",Not Rated,0,0
1082,tt0103905,2018-10-19,2018-10-19,,C'est arrivé près de chez vous,https://www.imdb.com/title/tt0103905/,movie,7.5,95,1992,"Comedy, Crime, Drama, Horror",33238,1992-05-31,"André Bonzel, Rémy Belvaux, Benoît Poelvoorde",,,7.38,1970-01-01T00:00:01,Belgium,"Benoît Poelvoorde, Jacqueline Poelvoorde-Pappaert, Nelly Pappaert, Hector Pappaert",NC-17,6,5
1083,tt2378281,2018-10-19,2018-10-19,,No se aceptan devoluciones,https://www.imdb.com/title/tt2378281/,movie,7.6,115,2013,"Comedy, Drama",26715,2013-08-30,Eugenio Derbez,,,7.60,1970-01-01T00:00:01,Mexico,"Andrés Vázquez, Hugo Stiglitz, Eugenio Derbez, Leia Freitas",PG-13,5,2
1084,tt0063415,2018-10-19,2018-10-19,,The Party,https://www.imdb.com/title/tt0063415/,movie,7.6,99,1968,Comedy,34674,1968-04-04,Blake Edwards,,,8.06,2017-02-14T00:00:00,USA,"Peter Sellers, Claudine Longet, Natalia Borisova, Jean Carson",PG,0,0
1085,tt0079588,2018-10-19,2018-10-19,,The Muppet Movie,https://www.imdb.com/title/tt0079588/,movie,7.6,95,1979,"Adventure, Comedy, Family, Musical",29313,1979-05-31,James Frawley,,,7.44,1970-01-01T00:00:01,"UK, USA","Jim Henson, Frank Oz, Jerry Nelson, Richard Hunt",G,3,9
1086,tt0076363,2018-10-19,2018-10-19,,The Many Adventures of Winnie the Pooh,https://www.imdb.com/title/tt0076363/,movie,7.6,74,1977,"Animation, Comedy, Family, Musical",29532,1977-03-11,"Wolfgang Reitherman, John Lounsbery",,,7.53,1970-01-01T00:00:01,USA,"Sebastian Cabot, Junius Matthews, Barbara Luddy, Howard Morris",G,0,1
1087,tt4849438,2018-10-19,2018-10-19,,Baahubali 2: The Conclusion,https://www.imdb.com/title/tt4849438/,movie,8.3,167,2017,"Action, Drama",65109,2017-04-27,S.S. Rajamouli,,,7.71,1970-01-01T00:00:01,India,"Prabhas, Rana Daggubati, Anushka Shetty, Sathyaraj",Not Rated,5,6
1088,tt6452574,2018-10-19,2018-10-19,,Sanju,https://www.imdb.com/title/tt6452574/,movie,8.0,155,2018,"Biography, Drama",39850,2018-06-28,Rajkumar Hirani,,,7.76,1970-01-01T00:00:01,India,"Ranbir Kapoor, Paresh Rawal, Manisha Koirala, Vicky Kaushal",N/A,0,0
1089,tt0367110,2018-10-19,2018-10-19,,"Swades: We, the People",https://www.imdb.com/title/tt0367110/,movie,8.3,210,2004,Drama,74136,2004-12-17,Ashutosh Gowariker,,,7.59,1970-01-01T00:00:01,India,"Shah Rukh Khan, Gayatri Joshi, Kishori Ballal, Smit Sheth",NOT RATED,12,23
1090,tt2631186,2018-10-19,2018-10-19,,Bahubali: The Beginning,https://www.imdb.com/title/tt2631186/,movie,8.1,159,2015,"Action, Drama",92744,2015-07-09,S.S. Rajamouli,,,7.73,1970-01-01T00:00:01,India,"Prabhas, Rana Daggubati, Ramya Krishnan, Sathyaraj",Not Rated,22,12
1091,tt5571734,2018-10-19,2018-10-19,,Pink,https://www.imdb.com/title/tt5571734/,movie,8.2,136,2016,"Drama, Thriller",31883,2016-09-16,Aniruddha Roy Chowdhury,,,7.40,1970-01-01T00:00:01,India,"Tapsee Pannu, Amitabh Bachchan, Kirti Kulhari, Andrea Tariang",Not Rated,8,7
1092,tt2140203,2018-10-19,2018-10-19,,Ookami kodomo no Ame to Yuki,https://www.imdb.com/title/tt2140203/,movie,8.1,117,2012,"Animation, Drama, Family, Fantasy",31233,2012-06-25,Mamoru Hosoda,,,7.90,1970-01-01T00:00:01,Japan,"Aoi Miyazaki, Takao Ohsawa, Haru Kuroki, Yukito Nishii",PG,19,6
1093,tt0375611,2018-10-19,2018-10-19,,Black,https://www.imdb.com/title/tt0375611/,movie,8.2,122,2005,Drama,30877,2005-02-04,Sanjay Leela Bhansali,,,7.39,1970-01-01T00:00:01,India,"Amitabh Bachchan, Rani Mukerji, Shernaz Patel, Ayesha Kapoor",Not Rated,30,3
1094,tt1171701,2018-10-19,2018-10-19,,Nefes: Vatan Sagolsun,https://www.imdb.com/title/tt1171701/,movie,8.1,128,2009,"Action, Drama, Thriller, War",29491,2009-10-16,Levent Semerci,,,7.92,1970-01-01T00:00:01,Turkey,"Mete Horozoglu, Ilker Kizmaz, Baris Bagci, Özgür Eren Koç",N/A,0,0
1095,tt1865505,2018-10-19,2018-10-19,,Song of the Sea,https://www.imdb.com/title/tt1865505/,movie,8.1,93,2014,"Animation, Adventure, Drama, Family, Fantasy",43605,2014-09-06,Tomm Moore,,,8.39,1970-01-01T00:00:01,"Ireland, Denmark, Belgium, Luxembourg, France","David Rawle, Brendan Gleeson, Lisa Hannigan, Fionnula Flanagan",PG,11,23
1096,tt0063227,2018-10-19,2018-10-19,,The Lion in Winter,https://www.imdb.com/title/tt0063227/,movie,8.1,134,1968,"Biography, Drama, History",26831,1968-10-30,Anthony Harvey,,,7.90,1970-01-01T00:00:01,"UK, USA","Peter O'Toole, Katharine Hepburn, Anthony Hopkins, John Castle",PG,12,18
1097,tt1360860,2018-10-19,2018-10-19,,Darbareye Elly,https://www.imdb.com/title/tt1360860/,movie,8.0,119,2009,"Drama, Mystery, Thriller",37839,2009-02-07,Asghar Farhadi,,,8.21,2015-02-07T00:00:00,"Iran, France","Golshifteh Farahani, Shahab Hosseini, Taraneh Alidoosti, Merila Zare'i",N/A,16,13
1098,tt2576852,2018-10-19,2018-10-19,,Kaguyahime no monogatari,https://www.imdb.com/title/tt2576852/,movie,8.0,137,2013,"Animation, Adventure, Drama, Family, Fantasy",28838,2013-11-23,Isao Takahata,,,8.19,2017-10-05T00:00:00,Japan,"Chloë Grace Moretz, James Caan, Mary Steenburgen, Darren Criss",PG,12,36
1099,tt8254556,2018-10-30,2018-10-30,,Girl,https://www.imdb.com/title/tt8254556/,movie,7.2,105,2018,Drama,6507,2018-05-12,Lukas Dhont,,,7.41,1970-01-01T00:00:01,"Belgium, Netherlands","Victor Polster, Arieh Worthalter, Oliver Bodart, Tijmen Govaerts",R,0,0
1100,tt7105944,2018-11-01,2018-11-01,,A casa tutti bene,https://www.imdb.com/title/tt7105944/,movie,6.1,105,2018,"Comedy, Drama, Romance",1314,2018-02-14,Gabriele Muccino,,,7.87,2017-03-10T00:00:00,Italy,"Stefano Accorsi, Carolina Crescentini, Elena Cucci, Pierfrancesco Favino",N/A,0,0
1101,tt7142506,2018-11-01,2018-11-01,,Sir,https://www.imdb.com/title/tt7142506/,movie,7.2,99,2018,"Drama, Romance",312,2018-05-14,Rohena Gera,,,7.94,1970-01-01T00:00:01,"India, France","Ahmareen Anjum, Vivek Gomber, Geetanjali Kulkarni, Tillotama Shome",N/A,0,0
1102,tt8297550,2018-11-01,2018-11-01,,Escher: Het Oneindige Zoeken,https://www.imdb.com/title/tt8297550/,movie,7.4,81,2018,Documentary,89,2018-04-12,Robin Lutz,,,7.73,1970-01-01T00:00:01,Netherlands,"George Escher, Jan Escher, Liesbeth Escher, Graham Nash",N/A,0,0
1103,tt6433456,2018-11-01,2018-11-01,,Unga Astrid,https://www.imdb.com/title/tt6433456/,movie,7.2,123,2018,"Biography, Drama",2301,2018-02-21,Pernille Fischer Christensen,,,7.73,1970-01-01T00:00:01,"Sweden, Denmark","Trine Dyrholm, Alba August, Maria Bonnevie, Magnus Krepper",N/A,0,0
1104,tt6040662,2018-11-01,2018-11-01,,The Children Act,https://www.imdb.com/title/tt6040662/,movie,6.7,105,2017,Drama,6832,2017-09-09,Richard Eyre,,,7.37,1970-01-01T00:00:01,"UK, USA","Emma Thompson, Stanley Tucci, Fionn Whitehead, Nikki Amuka-Bird",R,0,0
1105,tt7364566,2018-11-01,2018-11-01,,Maria by Callas,https://www.imdb.com/title/tt7364566/,movie,7.2,119,2017,"Documentary, Biography, Music",780,2017-11-09,Tom Volf,,,7.95,1970-01-01T00:00:01,France,"Fanny Ardant, Joyce DiDonato, Maria Callas, Aristotle Onassis",N/A,0,0
1106,tt4056808,2018-11-01,2018-11-01,,Datong,https://www.imdb.com/title/tt4056808/,movie,7.6,89,2015,"Documentary, Drama, News",433,2015-01-26,Hao Zhou,,,7.52,1970-01-01T00:00:01,China,"Li Fu, Ma Suying, Geng Yangbo, Song Yuhua",N/A,4,2
1107,tt6194424,2018-11-01,2018-11-01,,The Novgorod Spaceship,https://www.imdb.com/title/tt6194424/,movie,6.8,46,2016,Documentary,6,2016-01-01,Andrei Rozen,,,7.80,1970-01-01T00:00:01,USA,N/A,N/A,0,0
1108,tt4964788,2018-11-01,2018-11-01,,Todos lo saben,https://www.imdb.com/title/tt4964788/,movie,7.0,133,2018,"Crime, Drama, Mystery, Thriller",16783,2018-05-08,Asghar Farhadi,,,8.02,2015-02-07T00:00:00,"Spain, France, Italy","Penélope Cruz, Javier Bardem, Ricardo Darín, Eduard Fernández",R,0,0
1109,tt6768578,2018-11-01,2018-11-01,,Dogman,https://www.imdb.com/title/tt6768578/,movie,7.3,103,2018,"Crime, Drama, Thriller",12683,2018-05-16,Matteo Garrone,,,7.95,1970-01-01T00:00:01,"Italy, France","Marcello Fonte, Edoardo Pesce, Nunzia Schiano, Adamo Dionisi",N/A,0,0
1110,tt8269552,2018-11-01,2018-11-01,,Se rokh,https://www.imdb.com/title/tt8269552/,movie,7.1,100,2018,Drama,1689,2018-05-12,Jafar Panahi,,,7.48,1970-01-01T00:00:01,Iran,"Behnaz Jafari, Jafar Panahi, Marziyeh Rezaei, Maedeh Erteghaei",N/A,0,0
1111,tt6510332,2018-11-01,2018-11-01,,McQueen,https://www.imdb.com/title/tt6510332/,movie,7.9,111,2018,"Documentary, Biography",4657,2018-04-22,"Ian Bonhôte, Peter Ettedgui",,,7.56,1970-01-01T00:00:01,UK,"Bernard Arnault, Joseph Bennett, Detmar Blow, Isabella Blow",R,0,0
1112,tt6748466,2018-11-01,2018-11-01,,Loro 1,https://www.imdb.com/title/tt6748466/,movie,6.8,104,2018,"Biography, Drama",3851,2018-04-24,Paolo Sorrentino,,,7.70,1970-01-01T00:00:01,"Italy, France","Toni Servillo, Elena Sofia Ricci, Riccardo Scamarcio, Kasia Smutniak",N/A,0,0
1113,tt0018379,2018-11-06,2018-11-06,,7th Heaven,https://www.imdb.com/title/tt0018379/,movie,7.7,110,1927,"Drama, Romance",2734,1927-05-06,Frank Borzage,,,7.71,1970-01-01T00:00:01,USA,"Janet Gaynor, Charles Farrell, Albert Gran, David Butler",NOT RATED,3,2
1114,tt0024034,2018-11-06,2018-11-06,,42nd Street,https://www.imdb.com/title/tt0024034/,movie,7.6,89,1933,"Comedy, Musical, Romance",9576,1933-02-23,Lloyd Bacon,,,7.32,1970-01-01T00:00:01,USA,"Warner Baxter, Bebe Daniels, George Brent, Ruby Keeler",UNRATED,1,0
1115,tt0033627,2018-11-06,2018-11-06,,49th Parallel,https://www.imdb.com/title/tt0033627/,movie,7.4,123,1941,"Drama, War, Thriller",5183,1941-10-08,Michael Powell,,,7.64,1970-01-01T00:00:01,UK,"Leslie Howard, Raymond Massey, Laurence Olivier, Anton Walbrook",NOT RATED,2,2
1116,tt0022879,2018-11-06,2018-11-06,,A Farewell to Arms,https://www.imdb.com/title/tt0022879/,movie,6.5,80,1932,"Drama, Romance, War",4393,1932-12-08,Frank Borzage,,,7.46,1970-01-01T00:00:01,USA,"Helen Hayes, Gary Cooper, Adolphe Menjou, Mary Philips",UNRATED,1,2
1117,tt0041587,2018-11-06,2018-11-06,,A Letter to Three Wives,https://www.imdb.com/title/tt0041587/,movie,7.8,103,1949,"Drama, Romance",7533,1949-01-20,Joseph L. Mankiewicz,,,7.37,2016-04-27T00:00:00,USA,"Jeanne Crain, Linda Darnell, Ann Sothern, Kirk Douglas",UNRATED,3,1
1118,tt0026714,2018-11-06,2018-11-06,,A Midsummer Night's Dream,https://www.imdb.com/title/tt0026714/,movie,7.0,133,1935,"Comedy, Fantasy, Romance",2864,1935-10-09,"William Dieterle, Max Reinhardt",,,7.35,1970-01-01T00:00:01,USA,"Ian Hunter, Verree Teasdale, Hobart Cavanaugh, Dick Powell",APPROVED,0,2
1119,tt0043924,2018-11-06,2018-11-06,,A Place in the Sun,https://www.imdb.com/title/tt0043924/,movie,7.8,122,1951,"Drama, Romance",17997,1951-04-05,George Stevens,,,7.40,1970-01-01T00:00:01,USA,"Montgomery Clift, Elizabeth Taylor, Shelley Winters, Anne Revere",Passed,8,10
1120,tt1019452,2018-11-06,2018-11-06,,A Serious Man,https://www.imdb.com/title/tt1019452/,movie,7.1,106,2009,"Comedy, Drama",121280,2009-09-12,"Joel Coen, Ethan Coen",,,7.68,2017-01-17T00:00:00,"USA, UK, France","Michael Stuhlbarg, Richard Kind, Fred Melamed, Sari Lennick",R,17,72
1121,tt0088146,2018-11-06,2018-11-06,,A Soldier's Story,https://www.imdb.com/title/tt0088146/,movie,7.2,101,1984,"Crime, Drama, Mystery, War",8046,1984-09-13,Norman Jewison,,,8.08,2016-09-17T00:00:00,USA,"Howard E. Rollins Jr., Adolph Caesar, Art Evans, David Alan Grier",PG,5,6
