Position,Const,Created,Modified,Description,Title,URL,Title Type,IMDb Rating,Runtime (mins),Year,Genres,Num Votes,Release Date,Directors,Your Rating,Date Rated,recommendation,newdirector,Country,actor,rated,wins,nominations
750,tt2347569,2018-09-17,2018-09-17,,Frances Ha,https://www.imdb.com/title/tt2347569/,movie,7.4,86,2012,"Comedy, Drama, Romance",59645,2012-09-01,Noah Baumbach,,,7.91,1970-01-01T00:00:01,"USA, Brazil","Greta Gerwig, Mickey Sumner, Michael Esper, Adam Driver",R,1,47
751,tt0093389,2018-09-17,2018-09-17,,The Last Emperor,https://www.imdb.com/title/tt0093389/,movie,7.8,163,1987,"Biography, Drama, History",84735,1987-10-04,Bernardo Bertolucci,,,7.73,1970-01-01T00:00:01,"UK, Italy, China, France","John Lone, Joan Chen, Peter O'Toole, Ruocheng Ying",PG-13,47,16
752,tt0095631,2018-09-17,2018-09-17,,Midnight Run,https://www.imdb.com/title/tt0095631/,movie,7.6,126,1988,"Action, Comedy, Crime, Thriller",64312,1988-07-11,Martin Brest,,,7.64,2017-12-11T00:00:00,USA,"Robert De Niro, Charles Grodin, Yaphet Kotto, John Ashton",R,2,2
753,tt0104348,2018-09-17,2018-09-17,,Glengarry Glen Ross,https://www.imdb.com/title/tt0104348/,movie,7.8,100,1992,"Crime, Drama, Mystery",88379,1992-09-10,James Foley,,,7.94,1970-01-01T00:00:01,USA,"Al Pacino, Jack Lemmon, Alec Baldwin, Alan Arkin",R,8,12
754,tt0480025,2018-09-17,2018-09-17,,This Is England,https://www.imdb.com/title/tt0480025/,movie,7.7,101,2006,"Crime, Drama",109442,2006-09-12,Shane Meadows,,,7.64,1970-01-01T00:00:01,UK,"Thomas Turgoose, Stephen Graham, Jo Hartley, Andrew Shim",NOT RATED,13,15
755,tt0138704,2018-09-17,2018-09-17,,Pi,https://www.imdb.com/title/tt0138704/,movie,7.4,84,1998,"Drama, Horror, Mystery, Sci-Fi, Thriller",160177,1998-01-31,Darren Aronofsky,,,8.04,2015-03-07T00:00:00,USA,"Sean Gullette, Mark Margolis, Ben Shenkman, Pamela Hart",R,8,12
756,tt0026778,2018-09-17,2018-09-17,,A Night at the Opera,https://www.imdb.com/title/tt0026778/,movie,8.0,96,1935,"Comedy, Music, Musical",28516,1935-11-01,"Sam Wood, Edmund Goulding",,,8.05,1970-01-01T00:00:01,USA,"Groucho Marx, Chico Marx, Harpo Marx, Kitty Carlisle",NOT RATED,1,0
757,tt0087544,2018-09-17,2018-09-17,,Kaze no tani no Naushika,https://www.imdb.com/title/tt0087544/,movie,8.1,117,1984,"Animation, Adventure, Fantasy, Sci-Fi",127401,1984-03-11,Hayao Miyazaki,,,7.98,2015-03-06T00:00:00,"Japan, USA","Sumi Shimamoto, Mahito Tsujimura, Hisako Kyôda, Gorô Naya",PG,3,1
758,tt0126886,2018-09-17,2018-09-17,,Election,https://www.imdb.com/title/tt0126886/,movie,7.3,103,1999,"Comedy, Drama, Romance",82876,1999-04-23,Alexander Payne,,,7.86,2015-02-14T00:00:00,USA,"Matthew Broderick, Reese Witherspoon, Chris Klein, Jessica Campbell",R,16,33
759,tt0107943,2018-09-17,2018-09-17,,The Remains of the Day,https://www.imdb.com/title/tt0107943/,movie,7.9,134,1993,"Drama, Romance",57447,1993-10-25,James Ivory,,,7.77,1970-01-01T00:00:01,"USA, UK","John Haycraft, Christopher Reeve, Anthony Hopkins, Emma Thompson",PG,16,31
760,tt0061578,2018-09-17,2018-09-17,,The Dirty Dozen,https://www.imdb.com/title/tt0061578/,movie,7.8,150,1967,"Action, Adventure, War",61539,1967-06-15,Robert Aldrich,,,7.59,1970-01-01T00:00:01,"UK, USA","Lee Marvin, Ernest Borgnine, Charles Bronson, Jim Brown",Not Rated,3,8
761,tt0086541,2018-09-17,2018-09-17,,Videodrome,https://www.imdb.com/title/tt0086541/,movie,7.3,87,1983,"Horror, Sci-Fi, Thriller",74245,1983-02-04,David Cronenberg,,,7.57,1970-01-01T00:00:01,Canada,"James Woods, Sonja Smits, Debbie Harry, Peter Dvorsky",R,3,7
762,tt0086197,2018-09-17,2018-09-17,,The Right Stuff,https://www.imdb.com/title/tt0086197/,movie,7.9,193,1983,"Adventure, Biography, Drama, History",51860,1983-10-21,Philip Kaufman,,,8.29,1970-01-01T00:00:01,USA,"Sam Shepard, Scott Glenn, Ed Harris, Dennis Quaid",PG,7,15
763,tt0086979,2018-09-17,2018-09-17,,Blood Simple,https://www.imdb.com/title/tt0086979/,movie,7.6,99,1984,"Crime, Drama, Thriller",79438,1984-03-26,"Joel Coen, Ethan Coen",,,7.92,2017-01-17T00:00:00,USA,"John Getz, Frances McDormand, Dan Hedaya, M. Emmet Walsh",R,5,5
764,tt0986233,2018-09-17,2018-09-17,,Hunger,https://www.imdb.com/title/tt0986233/,movie,7.6,96,2008,"Biography, Drama",61010,2008-05-15,Steve McQueen,,,7.54,2016-12-09T00:00:00,"Ireland, UK","Stuart Graham, Laine Megaw, Brian Milligan, Liam McMahon",Not Rated,45,33
765,tt0060176,2018-09-17,2018-09-17,,Blowup,https://www.imdb.com/title/tt0060176/,movie,7.6,111,1966,"Drama, Mystery, Thriller",50504,1966-12-18,Michelangelo Antonioni,,,7.65,1970-01-01T00:00:01,"UK, Italy, USA","Vanessa Redgrave, Sarah Miles, David Hemmings, John Castle",Not Rated,7,6
766,tt0117802,2018-09-17,2018-09-17,,Swingers,https://www.imdb.com/title/tt0117802/,movie,7.3,96,1996,"Comedy, Drama",70869,1996-08-31,Doug Liman,,,7.70,1970-01-01T00:00:01,USA,"Jon Favreau, Vince Vaughn, Ron Livingston, Patrick Van Horn",R,3,3
767,tt0045555,2018-09-17,2018-09-17,,The Big Heat,https://www.imdb.com/title/tt0045555/,movie,8.0,89,1953,"Crime, Film-Noir, Thriller",20531,1953-10-14,Fritz Lang,,,7.59,2016-02-13T00:00:00,USA,"Glenn Ford, Gloria Grahame, Jocelyn Brando, Alexander Scourby",Not Rated,2,1
768,tt0098724,2018-09-17,2018-09-17,,"Sex, Lies, and Videotape",https://www.imdb.com/title/tt0098724/,movie,7.2,100,1989,Drama,44579,1989-01-20,Steven Soderbergh,,,7.51,2018-09-17T00:00:00,USA,"James Spader, Andie MacDowell, Peter Gallagher, Laura San Giacomo",R,15,22
769,tt0140352,2018-09-17,2018-09-17,,The Insider,https://www.imdb.com/title/tt0140352/,movie,7.9,157,1999,"Biography, Drama, Thriller",149271,1999-10-28,Michael Mann,,,7.99,2017-07-27T00:00:00,USA,"Al Pacino, Russell Crowe, Christopher Plummer, Diane Venora",R,23,50
770,tt0119229,2018-09-17,2018-09-17,,Grosse Pointe Blank,https://www.imdb.com/title/tt0119229/,movie,7.4,107,1997,"Action, Comedy, Crime, Romance, Thriller",81995,1997-04-11,George Armitage,,,7.89,1970-01-01T00:00:01,USA,"John Cusack, Minnie Driver, Alan Arkin, Dan Aykroyd",R,2,6
771,tt0104036,2018-09-17,2018-09-17,,The Crying Game,https://www.imdb.com/title/tt0104036/,movie,7.3,112,1992,"Crime, Drama, Romance, Thriller",47236,1992-09-02,Neil Jordan,,,8.19,1970-01-01T00:00:01,"UK, Japan, USA","Forest Whitaker, Miranda Richardson, Stephen Rea, Adrian Dunbar",R,21,46
772,tt0022913,2018-09-17,2018-09-17,,Freaks,https://www.imdb.com/title/tt0022913/,movie,7.9,64,1932,"Drama, Horror",38090,1932-02-12,Tod Browning,,,7.48,1970-01-01T00:00:01,USA,"Wallace Ford, Leila Hyams, Olga Baclanova, Roscoe Ates",NOT RATED,1,1
773,tt0032910,2018-09-17,2018-09-17,,Pinocchio,https://www.imdb.com/title/tt0032910/,movie,7.5,88,1940,"Animation, Comedy, Family, Fantasy, Musical",115362,1940-02-07,"Ben Sharpsteen, Jack Kinney, Hamilton Luske, Wilfred Jackson, T. Hee, Bill Roberts, Norman Ferguson",,,7.36,1970-01-01T00:00:01,USA,"Jack Bailey, Mel Blanc, Billy Bletcher, Don Brodie",G,4,0
774,tt0047437,2018-09-17,2018-09-17,,Sabrina,https://www.imdb.com/title/tt0047437/,movie,7.7,113,1954,"Comedy, Drama, Romance",53106,1954-09-03,Billy Wilder,,,8.10,2018-07-18T00:00:00,USA,"Humphrey Bogart, Audrey Hepburn, William Holden, Walter Hampden",NOT RATED,5,8
775,tt0299977,2018-09-17,2018-09-17,,Ying xiong,https://www.imdb.com/title/tt0299977/,movie,7.9,107,2002,"Action, Adventure, History",165439,2002-10-24,Yimou Zhang,,,7.87,1970-01-01T00:00:01,"China, Hong Kong","Jet Li, Tony Chiu-Wai Leung, Maggie Cheung, Ziyi Zhang",PG-13,37,39
776,tt0117731,2018-09-17,2018-09-17,,Star Trek: First Contact,https://www.imdb.com/title/tt0117731/,movie,7.6,111,1996,"Action, Adventure, Drama, Sci-Fi, Thriller",109907,1996-11-18,Jonathan Frakes,,,8.14,1970-01-01T00:00:01,USA,"Patrick Stewart, Jonathan Frakes, Brent Spiner, LeVar Burton",PG-13,8,20
777,tt0069995,2018-09-17,2018-09-17,,Don't Look Now,https://www.imdb.com/title/tt0069995/,movie,7.3,110,1973,"Drama, Horror, Thriller",42691,1973-10-11,Nicolas Roeg,,,7.56,1970-01-01T00:00:01,"UK, Italy","Julie Christie, Donald Sutherland, Hilary Mason, Clelia Matania",R,0,8
778,tt0067800,2018-09-17,2018-09-17,,Straw Dogs,https://www.imdb.com/title/tt0067800/,movie,7.5,113,1971,"Crime, Drama, Thriller",51845,1971-11-25,Sam Peckinpah,,,7.77,1970-01-01T00:00:01,"UK, USA","Dustin Hoffman, Susan George, Peter Vaughan, T.P. McKenna",R,1,1
779,tt0876563,2018-09-17,2018-09-17,,Gake no ue no Ponyo,https://www.imdb.com/title/tt0876563/,movie,7.7,101,2008,"Animation, Adventure, Comedy, Family, Fantasy",106675,2008-07-19,Hayao Miyazaki,,,7.60,2015-03-06T00:00:00,Japan,"Tomoko Yamaguchi, Kazushige Nagashima, Yûki Amami, George Tokoro",G,11,19
780,tt0132477,2018-09-17,2018-09-17,,October Sky,https://www.imdb.com/title/tt0132477/,movie,7.8,108,1999,"Biography, Drama, Family",74943,1999-02-19,Joe Johnston,,,7.89,1970-01-01T00:00:01,USA,"Jake Gyllenhaal, Chris Cooper, Laura Dern, Chris Owen",PG,4,11
781,tt0063462,2018-09-17,2018-09-17,,The Producers,https://www.imdb.com/title/tt0063462/,movie,7.7,88,1967,"Comedy, Music",46167,1967-11-22,Mel Brooks,,,8.07,1970-01-01T00:00:01,USA,"Estelle Winwood, Renée Taylor, David Patch, William Hickey",PG,2,5
782,tt0100150,2018-09-17,2018-09-17,,Miller's Crossing,https://www.imdb.com/title/tt0100150/,movie,7.8,115,1990,"Crime, Drama, Thriller",117876,1990-09-21,"Joel Coen, Ethan Coen",,,7.96,2017-01-17T00:00:00,USA,"Gabriel Byrne, Marcia Gay Harden, John Turturro, Jon Polito",R,4,15
783,tt0978762,2018-09-17,2018-09-17,,Mary and Max,https://www.imdb.com/title/tt0978762/,movie,8.1,92,2009,"Animation, Comedy, Drama",150227,2009-01-15,Adam Elliot,,,7.76,1970-01-01T00:00:01,Australia,"Toni Collette, Philip Seymour Hoffman, Barry Humphries, Eric Bana",NOT RATED,4,9
784,tt0094947,2018-09-17,2018-09-17,,Dangerous Liaisons,https://www.imdb.com/title/tt0094947/,movie,7.6,119,1988,"Drama, Romance",59775,1988-12-11,Stephen Frears,,,7.64,1970-01-01T00:00:01,"USA, UK","Glenn Close, John Malkovich, Michelle Pfeiffer, Swoosie Kurtz",R,16,20
785,tt0093748,2018-09-17,2018-09-17,,"Planes, Trains & Automobiles",https://www.imdb.com/title/tt0093748/,movie,7.6,93,1987,Comedy,109532,1987-11-25,John Hughes,,,8.01,1970-01-01T00:00:01,USA,"Steve Martin, John Candy, Laila Robins, Michael McKean",R,0,1
786,tt0109707,2018-09-17,2018-09-17,,Ed Wood,https://www.imdb.com/title/tt0109707/,movie,7.9,127,1994,"Biography, Comedy, Drama",157074,1994-09-23,Tim Burton,,,7.75,2015-03-08T00:00:00,USA,"Johnny Depp, Martin Landau, Sarah Jessica Parker, Patricia Arquette",R,23,28
787,tt0091867,2018-09-17,2018-09-17,,A Room with a View,https://www.imdb.com/title/tt0091867/,movie,7.4,117,1985,"Drama, Romance",35755,1985-12-13,James Ivory,,,7.62,1970-01-01T00:00:01,UK,"Maggie Smith, Helena Bonham Carter, Denholm Elliott, Julian Sands",NOT RATED,21,23
788,tt0081283,2018-09-17,2018-09-17,,Ordinary People,https://www.imdb.com/title/tt0081283/,movie,7.8,124,1980,Drama,42032,1980-09-19,Robert Redford,,,7.51,1970-01-01T00:00:01,USA,"Donald Sutherland, Mary Tyler Moore, Judd Hirsch, Timothy Hutton",R,15,14
789,tt0103873,2018-09-17,2018-09-17,,Braindead,https://www.imdb.com/title/tt0103873/,movie,7.5,104,1992,"Comedy, Horror",86336,1992-07-30,Peter Jackson,,,7.79,2019-03-26T00:00:00,New Zealand,"Timothy Balme, Diana Peñalver, Elizabeth Moody, Ian Watkin",R,13,5
790,tt0107554,2018-09-17,2018-09-17,,Menace II Society,https://www.imdb.com/title/tt0107554/,movie,7.5,97,1993,"Crime, Drama, Thriller",46501,1993-05-26,"Allen Hughes, Albert Hughes",,,7.94,1970-01-01T00:00:01,USA,"Tyrin Turner, Larenz Tate, June Kyoto Lu, Toshi Toda",R,2,4
791,tt0307901,2018-09-17,2018-09-17,,25th Hour,https://www.imdb.com/title/tt0307901/,movie,7.7,135,2002,Drama,162438,2002-12-16,Spike Lee,,,7.50,1970-01-01T00:00:01,USA,"Edward Norton, Philip Seymour Hoffman, Barry Pepper, Rosario Dawson",R,4,14
792,tt0077402,2018-09-17,2018-09-17,,Dawn of the Dead,https://www.imdb.com/title/tt0077402/,movie,7.9,127,1978,"Horror, Thriller",103049,1978-09-01,George A. Romero,,,7.20,1970-01-01T00:00:01,USA,"David Emge, Ken Foree, Scott H. Reiniger, Gaylen Ross",UNRATED,2,2
793,tt0086425,2018-09-17,2018-09-17,,Terms of Endearment,https://www.imdb.com/title/tt0086425/,movie,7.4,132,1983,"Comedy, Drama",49210,1983-11-20,James L. Brooks,,,7.81,1970-01-01T00:00:01,USA,"Shirley MacLaine, Debra Winger, Jack Nicholson, Danny DeVito",PG,27,18
794,tt2053425,2018-09-17,2018-09-17,,De rouille et d'os,https://www.imdb.com/title/tt2053425/,movie,7.5,120,2012,"Drama, Romance",58665,2012-05-17,Jacques Audiard,,,8.03,2016-09-29T00:00:00,"France, Belgium","Marion Cotillard, Matthias Schoenaerts, Armand Verdure, Céline Sallette",R,32,68
795,tt0443680,2018-09-17,2018-09-17,,The Assassination of Jesse James by the Coward Robert Ford,https://www.imdb.com/title/tt0443680/,movie,7.5,160,2007,"Biography, Crime, Drama, History, Western",156541,2007-09-02,Andrew Dominik,,,8.24,1970-01-01T00:00:01,"USA, Canada, UK","Brad Pitt, Mary-Louise Parker, Brooklynn Proulx, Dustin Bollinger",R,25,65
796,tt0097108,2018-09-17,2018-09-17,,"The Cook, the Thief, His Wife & Her Lover",https://www.imdb.com/title/tt0097108/,movie,7.6,124,1989,"Crime, Drama",31560,1989-09-04,Peter Greenaway,,,7.35,1970-01-01T00:00:01,"Netherlands, UK, France","Richard Bohringer, Michael Gambon, Helen Mirren, Alan Howard",NC-17,7,10
797,tt0058385,2018-09-17,2018-09-17,,My Fair Lady,https://www.imdb.com/title/tt0058385/,movie,7.9,170,1964,"Drama, Family, Musical, Romance",79422,1964-10-21,George Cukor,,,7.72,1970-01-01T00:00:01,USA,"Audrey Hepburn, Rex Harrison, Stanley Holloway, Wilfrid Hyde-White",G,16,13
798,tt0062765,2018-09-17,2018-09-17,,Bullitt,https://www.imdb.com/title/tt0062765/,movie,7.5,114,1968,"Action, Crime, Mystery, Thriller",55080,1968-10-17,Peter Yates,,,7.62,1970-01-01T00:00:01,USA,"Steve McQueen, Robert Vaughn, Jacqueline Bisset, Don Gordon",M/PG,6,9
799,tt0095159,2018-09-17,2018-09-17,,A Fish Called Wanda,https://www.imdb.com/title/tt0095159/,movie,7.6,108,1988,"Comedy, Crime",122035,1988-07-07,"Charles Crichton, John Cleese",,,7.62,1970-01-01T00:00:01,"UK, USA","John Cleese, Jamie Lee Curtis, Kevin Kline, Michael Palin",R,8,18
800,tt0070917,2018-09-17,2018-09-17,,The Wicker Man,https://www.imdb.com/title/tt0070917/,movie,7.6,88,1973,"Horror, Mystery, Thriller",58526,1973-12-06,Robin Hardy,,,7.45,1970-01-01T00:00:01,UK,"Edward Woodward, Christopher Lee, Diane Cilento, Britt Ekland",R,1,6
801,tt0093822,2018-09-17,2018-09-17,,Raising Arizona,https://www.imdb.com/title/tt0093822/,movie,7.4,94,1987,"Comedy, Crime",116106,1987-03-06,"Joel Coen, Ethan Coen",,,7.62,2017-01-17T00:00:00,USA,"Nicolas Cage, Holly Hunter, Trey Wilson, John Goodman",PG-13,0,4
802,tt0162346,2018-09-17,2018-09-17,,Ghost World,https://www.imdb.com/title/tt0162346/,movie,7.4,111,2001,"Comedy, Drama",106615,2001-06-16,Terry Zwigoff,,,7.75,1970-01-01T00:00:01,"USA, UK, Germany","Thora Birch, Scarlett Johansson, Steve Buscemi, Brad Renfro",R,28,55
803,tt0092991,2018-09-17,2018-09-17,,Evil Dead II,https://www.imdb.com/title/tt0092991/,movie,7.8,84,1987,"Comedy, Horror",134868,1987-03-13,Sam Raimi,,,8.02,1970-01-01T00:00:01,USA,"Bruce Campbell, Sarah Berry, Dan Hicks, Kassie Wesley DePaiva",R,0,5
804,tt0399146,2018-09-17,2018-09-17,,A History of Violence,https://www.imdb.com/title/tt0399146/,movie,7.5,96,2005,"Drama, Thriller",210240,2005-05-16,David Cronenberg,,,7.78,1970-01-01T00:00:01,"USA, Germany, Canada","Viggo Mortensen, Maria Bello, Ed Harris, William Hurt",R,37,78
805,tt0146882,2018-09-17,2018-09-17,,High Fidelity,https://www.imdb.com/title/tt0146882/,movie,7.5,113,2000,"Comedy, Drama, Music, Romance",158045,2000-03-17,Stephen Frears,,,7.70,1970-01-01T00:00:01,"UK, USA","John Cusack, Iben Hjejle, Todd Louiso, Jack Black",R,3,21
806,tt0101889,2018-09-17,2018-09-17,,The Fisher King,https://www.imdb.com/title/tt0101889/,movie,7.6,137,1991,"Comedy, Drama, Fantasy",73211,1991-09-10,Terry Gilliam,,,7.81,2015-11-04T00:00:00,USA,"Jeff Bridges, Adam Bryant, Paul Lombardi, David Hyde Pierce",R,13,34
807,tt1306980,2018-09-17,2018-09-17,,50/50,https://www.imdb.com/title/tt1306980/,movie,7.7,100,2011,"Comedy, Drama, Romance",299468,2011-09-12,Jonathan Levine,,,7.83,1970-01-01T00:00:01,USA,"Joseph Gordon-Levitt, Seth Rogen, Anna Kendrick, Bryce Dallas Howard",R,12,25
808,tt0113568,2018-09-17,2018-09-17,,Kôkaku Kidôtai,https://www.imdb.com/title/tt0113568/,movie,8.0,83,1995,"Animation, Action, Crime, Drama, Mystery, Sci-Fi, Thriller",114660,1995-09-23,Mamoru Oshii,,,8.08,1970-01-01T00:00:01,"Japan, UK","Atsuko Tanaka, Akio Ôtsuka, Kôichi Yamadera, Yutaka Nakano",NOT RATED,5,2
809,tt1189073,2018-09-17,2018-09-17,,La piel que habito,https://www.imdb.com/title/tt1189073/,movie,7.6,120,2011,"Drama, Horror, Thriller",122815,2011-05-19,Pedro Almodóvar,,,7.79,1970-01-01T00:00:01,Spain,"Antonio Banderas, Elena Anaya, Marisa Paredes, Jan Cornet",R,27,66
810,tt0462322,2018-09-17,2018-09-17,,Grindhouse,https://www.imdb.com/title/tt0462322/,movie,7.6,191,2007,"Action, Horror, Thriller",169359,2007-03-26,"Edgar Wright, Rob Zombie, Quentin Tarantino, Robert Rodriguez, Eli Roth",,,7.63,2015-02-07T00:00:00,"USA, Mexico, Canada, UK","Kurt Russell, Zoë Bell, Rosario Dawson, Vanessa Ferlito",R,7,15
811,tt0765443,2018-09-17,2018-09-17,,Eastern Promises,https://www.imdb.com/title/tt0765443/,movie,7.6,100,2007,"Crime, Drama, Thriller",213837,2007-09-08,David Cronenberg,,,7.99,1970-01-01T00:00:01,"UK, Canada, USA","Josef Altin, Mina E. Mina, Aleksandar Mikic, Sarah-Jeanne Labrosse",R,28,70
812,tt0280707,2018-09-17,2018-09-17,,Gosford Park,https://www.imdb.com/title/tt0280707/,movie,7.3,131,2001,"Comedy, Drama, Mystery",73238,2001-11-07,Robert Altman,,,7.76,1970-01-01T00:00:01,"UK, USA, Italy","Maggie Smith, Michael Gambon, Kristin Scott Thomas, Camilla Rutherford",R,31,73
813,tt1125849,2018-09-17,2018-09-17,,The Wrestler,https://www.imdb.com/title/tt1125849/,movie,7.9,109,2008,"Drama, Sport",276568,2008-09-05,Darren Aronofsky,,,7.83,2015-03-07T00:00:00,"USA, France","Mickey Rourke, Marisa Tomei, Evan Rachel Wood, Mark Margolis",R,57,86
814,tt0098258,2018-09-17,2018-09-17,,Say Anything...,https://www.imdb.com/title/tt0098258/,movie,7.4,100,1989,"Comedy, Drama, Romance",76236,1989-04-14,Cameron Crowe,,,7.71,1970-01-01T00:00:01,USA,"John Cusack, Ione Skye, John Mahoney, Lili Taylor",PG-13,1,3
815,tt1038988,2018-09-17,2018-09-17,,[Rec],https://www.imdb.com/title/tt1038988/,movie,7.5,78,2007,"Horror, Mystery, Thriller",152708,2007-08-29,"Jaume Balagueró, Paco Plaza",,,7.63,1970-01-01T00:00:01,Spain,"Manuela Velasco, Ferran Terraza, Jorge-Yamam Serrano, Pablo Rosso",R,16,12
816,tt0095705,2018-09-17,2018-09-17,,The Naked Gun: From the Files of Police Squad!,https://www.imdb.com/title/tt0095705/,movie,7.6,85,1988,"Comedy, Crime",135872,1988-12-02,David Zucker,,,7.62,1970-01-01T00:00:01,USA,"Leslie Nielsen, Priscilla Presley, Ricardo Montalban, George Kennedy",PG-13,0,1
817,tt1313092,2018-09-17,2018-09-17,,Animal Kingdom,https://www.imdb.com/title/tt1313092/,movie,7.3,113,2010,"Crime, Drama",51421,2010-01-22,David Michôd,,,7.77,1970-01-01T00:00:01,Australia,"James Frecheville, Bryce Lindemann, Paul Smits, Jacki Weaver",R,38,54
818,tt0063350,2018-09-17,2018-09-17,,Night of the Living Dead,https://www.imdb.com/title/tt0063350/,movie,7.9,96,1968,Horror,104587,1968-10-01,George A. Romero,,,7.77,1970-01-01T00:00:01,USA,"Duane Jones, Judith O'Dea, Karl Hardman, Marilyn Eastman",NOT RATED,2,1
819,tt0120780,2018-09-17,2018-09-17,,Out of Sight,https://www.imdb.com/title/tt0120780/,movie,7.0,123,1998,"Crime, Drama, Romance, Thriller",79570,1998-06-26,Steven Soderbergh,,,8.21,2018-09-17T00:00:00,USA,"George Clooney, Jennifer Lopez, Jim Robinson, Mike Malone",R,13,12
820,tt0373074,2018-09-17,2018-09-17,,Kung fu,https://www.imdb.com/title/tt0373074/,movie,7.8,99,2004,"Action, Comedy, Fantasy",116036,2004-09-14,Stephen Chow,,,7.70,1970-01-01T00:00:01,"Hong Kong, China","Stephen Chow, Xiaogang Feng, Wah Yuen, Zhihua Dong",R,23,45
821,tt0070666,2018-09-17,2018-09-17,,Serpico,https://www.imdb.com/title/tt0070666/,movie,7.8,130,1973,"Biography, Crime, Drama, Thriller",96583,1973-12-05,Sidney Lumet,,,7.91,2017-10-21T00:00:00,"USA, Italy","Al Pacino, John Randolph, Jack Kehoe, Biff McGuire",R,5,9
822,tt0268126,2018-09-17,2018-09-17,,Adaptation.,https://www.imdb.com/title/tt0268126/,movie,7.7,115,2002,"Comedy, Drama",164674,2002-12-03,Spike Jonze,,,7.98,1970-01-01T00:00:01,USA,"Nicolas Cage, Tilda Swinton, Meryl Streep, Chris Cooper",R,64,100
823,tt0090329,2018-09-17,2018-09-17,,Witness,https://www.imdb.com/title/tt0090329/,movie,7.4,112,1985,"Crime, Drama, Romance, Thriller",78147,1985-02-07,Peter Weir,,,8.23,2017-06-07T00:00:00,USA,"Harrison Ford, Kelly McGillis, Josef Sommer, Lukas Haas",R,11,25
824,tt1588170,2018-09-17,2018-09-17,,Ang-ma-reul bo-at-da,https://www.imdb.com/title/tt1588170/,movie,7.8,142,2010,"Action, Crime, Drama, Horror, Thriller",93297,2010-08-12,Jee-woon Kim,,,7.89,1970-01-01T00:00:01,South Korea,"Byung-Hun Lee, Min-sik Choi, Joon-Hyuk Lee, In-seo Kim",NOT RATED,16,19
825,tt0104797,2018-09-17,2018-09-17,,Malcolm X,https://www.imdb.com/title/tt0104797/,movie,7.7,202,1992,"Biography, Drama, History, Romance",75492,1992-11-18,Spike Lee,,,8.17,1970-01-01T00:00:01,"USA, Japan","Denzel Washington, Angela Bassett, Albert Hall, Al Freeman Jr.",PG-13,18,22
826,tt0101507,2018-09-17,2018-09-17,,Boyz n the Hood,https://www.imdb.com/title/tt0101507/,movie,7.8,112,1991,"Crime, Drama",111669,1991-05-13,John Singleton,,,7.74,1970-01-01T00:00:01,USA,"Hudhail Al-Amir, Lloyd Avery II, Angela Bassett, Miya McGhee",R,11,14
827,tt0064276,2018-09-17,2018-09-17,,Easy Rider,https://www.imdb.com/title/tt0064276/,movie,7.4,95,1969,"Adventure, Drama",88145,1969-05-12,Dennis Hopper,,,7.67,1970-01-01T00:00:01,USA,"Peter Fonda, Dennis Hopper, Antonio Mendoza, Phil Spector",R,8,12
828,tt0096754,2018-09-17,2018-09-17,,The Abyss,https://www.imdb.com/title/tt0096754/,movie,7.6,145,1989,"Adventure, Drama, Mystery, Sci-Fi, Thriller",150764,1989-08-08,James Cameron,,,8.10,2015-12-28T00:00:00,USA,"Ed Harris, Mary Elizabeth Mastrantonio, Michael Biehn, Leo Burmester",PG-13,8,15
829,tt0017136,2018-09-17,2018-09-17,,Metropolis,https://www.imdb.com/title/tt0017136/,movie,8.3,153,1927,"Drama, Sci-Fi",142503,1927-01-10,Fritz Lang,,,7.58,2016-02-13T00:00:00,Germany,"Alfred Abel, Gustav Fröhlich, Rudolf Klein-Rogge, Fritz Rasp",NOT RATED,6,5
830,tt0084805,2018-09-17,2018-09-17,,Tootsie,https://www.imdb.com/title/tt0084805/,movie,7.4,116,1982,"Comedy, Drama, Romance",89051,1982-12-01,Sydney Pollack,,,7.90,1970-01-01T00:00:01,USA,"Dustin Hoffman, Jessica Lange, Teri Garr, Dabney Coleman",PG,24,30
831,tt0106519,2018-09-17,2018-09-17,,Carlito's Way,https://www.imdb.com/title/tt0106519/,movie,7.9,144,1993,"Crime, Drama, Thriller",184986,1993-11-07,Brian De Palma,,,7.93,2015-02-08T00:00:00,USA,"Al Pacino, Sean Penn, Penelope Ann Miller, John Leguizamo",R,1,5
832,tt0274558,2018-09-17,2018-09-17,,The Hours,https://www.imdb.com/title/tt0274558/,movie,7.6,110,2002,"Drama, Romance",116307,2002-12-15,Stephen Daldry,,,7.86,2016-06-28T00:00:00,"USA, UK","Nicole Kidman, Julianne Moore, Meryl Streep, Stephen Dillane",PG-13,41,125
833,tt0109445,2018-09-17,2018-09-17,,Clerks,https://www.imdb.com/title/tt0109445/,movie,7.8,92,1994,Comedy,200938,1994-01-31,Kevin Smith,,,8.03,1970-01-01T00:00:01,USA,"Brian O'Halloran, Jeff Anderson, Marilyn Ghigliotti, Lisa Spoonauer",R,5,10
834,tt0107818,2018-09-17,2018-09-17,,Philadelphia,https://www.imdb.com/title/tt0107818/,movie,7.7,125,1993,Drama,205593,1993-12-14,Jonathan Demme,,,7.84,2015-02-07T00:00:00,USA,"Tom Hanks, Denzel Washington, Roberta Maxwell, Buzz Kilman",PG-13,15,22
835,tt0128445,2018-09-17,2018-09-17,,Rushmore,https://www.imdb.com/title/tt0128445/,movie,7.7,93,1998,"Comedy, Drama",156780,1998-09-17,Wes Anderson,,,7.74,1970-01-01T00:00:01,USA,"Jason Schwartzman, Bill Murray, Olivia Williams, Seymour Cassel",R,16,15
836,tt0129167,2018-09-17,2018-09-17,,The Iron Giant,https://www.imdb.com/title/tt0129167/,movie,8.0,86,1999,"Animation, Action, Adventure, Comedy, Drama, Family, Sci-Fi",156027,1999-07-31,Brad Bird,,,7.95,1970-01-01T00:00:01,USA,"Jennifer Aniston, Harry Connick Jr., Vin Diesel, James Gammon",PG,20,18
837,tt0094625,2018-09-17,2018-09-17,,Akira,https://www.imdb.com/title/tt0094625/,movie,8.1,124,1988,"Animation, Drama, Sci-Fi, Thriller",138220,1988-07-16,Katsuhiro Ôtomo,,,7.77,1970-01-01T00:00:01,Japan,"Mitsuo Iwata, Nozomu Sasaki, Mami Koyama, Tesshô Genda",R,1,0
838,tt0333766,2018-09-17,2018-09-17,,Garden State,https://www.imdb.com/title/tt0333766/,movie,7.5,102,2004,"Comedy, Drama, Romance",200948,2004-01-16,Zach Braff,,,7.86,1970-01-01T00:00:01,USA,"Zach Braff, Kenneth Graymez, George C. Wolfe, Austin Lysy",R,13,38
839,tt0029583,2018-09-17,2018-09-17,,Snow White and the Seven Dwarfs,https://www.imdb.com/title/tt0029583/,movie,7.6,83,1937,"Animation, Family, Fantasy, Musical, Romance",163406,1937-12-21,"William Cottrell, Perce Pearce, Ben Sharpsteen, David Hand, Wilfred Jackson, Larry Morey",,,7.58,1970-01-01T00:00:01,USA,"Roy Atwell, Stuart Buchanan, Adriana Caselotti, Eddie Collins",G,11,5
840,tt0249462,2018-09-17,2018-09-17,,Billy Elliot,https://www.imdb.com/title/tt0249462/,movie,7.7,110,2000,"Drama, Music, Romance",114560,2000-05-19,Stephen Daldry,,,7.80,2016-06-28T00:00:00,"UK, France","Jamie Bell, Jean Heywood, Jamie Draven, Gary Lewis",R,54,65
841,tt0118929,2018-09-17,2018-09-17,,Dark City,https://www.imdb.com/title/tt0118929/,movie,7.7,100,1998,"Mystery, Sci-Fi, Thriller",176897,1998-02-25,Alex Proyas,,,7.87,1970-01-01T00:00:01,"Australia, USA","Rufus Sewell, William Hurt, Kiefer Sutherland, Jennifer Connelly",R,10,15
842,tt0057076,2018-09-17,2018-09-17,,From Russia with Love,https://www.imdb.com/title/tt0057076/,movie,7.4,115,1963,"Action, Adventure, Thriller",105549,1963-10-10,Terence Young,,,7.62,1970-01-01T00:00:01,UK,"Sean Connery, Daniela Bianchi, Pedro Armendáriz, Lotte Lenya",PG,3,5
